"id","title","url","image_url","post","date_created","category"
"32","Sony Pushing Bungie to Treat Destiny 2 More Like a Business Is Beneficial, Says Former Studio Lawyer","sony-pushing-bungie-to-treat-destiny-2-more-like-a-business-is-beneficial-says-former-studio-lawyer","/blog-img/Destiny_2.jpg","<p>In the rapidly evolving world of gaming, Destiny 2 has stood out as a monumental title with a dedicated player base and expansive lore. However, the game has faced its share of challenges, particularly in meeting its financial and player engagement targets. With recent strategic changes implemented under the guidance of parent company Sony, Destiny 2 is set for a significant transformation that could redefine its future trajectory.</p>
<p>Last week, Bungie announced what it described as ""major changes"" to the structure and delivery of Destiny 2 content. This overhaul is not just a response to underwhelming performance and reception, such as the lackluster launch of the Final Shape expansion, but a strategic pivot towards a more sustainable model. The new strategy involves the release of two medium-sized expansions and four major free content updates annually, aiming to keep the game's content fresh and engaging for players throughout the year.</p>
<p>This shift is indicative of Sony's increasing influence on Bungie's operations, encouraging the studio to adopt more business-centric practices. Don McGowan, former general counsel at Bungie, has openly commended Sony’s role in enforcing these changes. In a reaction to a roundup of Destiny 2 updates, McGowan emphasized that Sony's involvement had pushed Bungie to address significant issues within the game and its management, transitioning from a passion-driven project to a more structured business model.</p>
<p>""The changes described are what you do to run a franchise, not just to keep making the game you and your friends have mastered, or to chase trends,"" McGowan stated. This comment highlights a shift from internal self-satisfaction towards a focus on broad-based player acquisition and retention strategies, fundamental to sustaining and growing the game’s success.</p>
<p>Moreover, the planned changes to the game’s user interface aim to make Destiny 2 more accessible to newcomers. Game director Tyson Green acknowledged the game's complexity, noting that navigating the myriad of activities was daunting for many. The forthcoming UI overhaul is designed to simplify navigation and enhance user experience, making it easier for players to engage with the game’s content.</p>
<p>These strategic shifts come during a turbulent time for Bungie, which announced significant layoffs earlier this year. The restructuring includes the integration of 155 workers into Sony Interactive Entertainment, reflecting deeper synergies being explored between Bungie and Sony.</p>
<p>Amidst these strategic overhauls, Bungie remains committed to its existing and future projects, including the ongoing development of its Marathon revival, despite rumors of a complete takeover by Sony and the cancellation of other projects like the Destiny spinoff, Payback.</p>
<p>This ongoing evolution of Destiny 2 under Sony's stewardship could serve as a pivotal case study in how large-scale gaming franchises can adapt to market demands and internal challenges. For players and industry observers alike, these changes are to watch, as they could dictate the game’s trajectory in the competitive gaming market.</p>
<p>As Destiny 2 continues to evolve, fans can catch a glimpse of similar transformations and innovations in the gaming world by exploring titles and discussions at <a href=""https://www.kizi10.org/blog/rare-ps2-horror-game-sees-significant-price-drop"" target=""_new"" rel=""noopener"">Kizi10</a>, where insights into gaming trends and changes are regularly updated.</p>
<p>With Sony's backing, Bungie's ""Adventure Jungle"" now appears poised for a new era, blending rich content delivery with robust business strategies to secure its place in the annals of gaming history. As the landscape shifts, the integration of strategic business practices within creative frameworks like those seen in Destiny 2 could become a blueprint for success in the industry.</p>","2024-09-22","3"
"33","Louisiana Company Sues PlayStation, Shift Up Over Stellarblade Name Dispute","louisiana-company-sues-playstation-shift-up-over-stellarblade-name-dispute","/blog-img/Stellarblade.jpg","<p>In a brewing legal battle that highlights the complexities of trademark law within the digital age, Louisiana-based multimedia company Stellarblade LLC has filed a lawsuit against video game developer Shift Up and publisher Sony. The suit, centered around the use of the name ""Stellar Blade,"" alleges trademark infringement and significant business disruption for the Louisiana company.</p>
<h4>Background of the Conflict</h4>
<p>Stellarblade LLC, founded by Griffith Chambers Mehaffey, has been providing multimedia entertainment services including film, documentary, commercial, and music video production since 2010. Mehaffey, who has operated the domain stellarblade.com since 2006, claims that the recent renaming of Shift Up's video game to ""Stellar Blade"" has caused confusion and diverted online traffic away from his business, overshadowing his multimedia services with video game content.</p>
<p>Originally announced as Project Eve in 2019, the game caught attention during its re-reveal at a 2021 PlayStation Showcase. It wasn’t until 2022 that Shift Up renamed the project to Stellar Blade, a move followed by their trademark registration in January 2023. In response, Mehaffey registered his trademark for Stellarblade in June 2023 and issued a cease and desist letter to Shift Up shortly thereafter.</p>
<h4>The Legal Claims</h4>
<p>Mehaffey's lawsuit, filed earlier this month in a Louisiana court, details the challenges faced by his business due to the alleged infringement. The complaint specifies that the ""confusingly similar"" trademarks, even down to the color schemes and stylized 'S' in the logos, have led to a significant mix-up among consumers seeking Mehaffey’s services but finding the video game instead.</p>
<p>The complaint demands that Shift Up and Sony cease using the name Stellar Blade or any derivative thereof, surrender all materials bearing the name for destruction, and compensate Mehaffey for damages and attorney fees. The legal documents underscore Mehaffey’s longstanding use of the Stellarblade name and his claim to prior rights, which his legal team argues should have been acknowledged by the defendants.</p>
<h4>Industry Implications and Commentary</h4>
<p>This lawsuit underscores the potential pitfalls of naming and branding in the global digital marketplace, where visibility on search engines can significantly impact a business’s success. It also raises questions about the responsibilities of large corporations in respecting existing trademarks, regardless of geographical or industry boundaries.</p>
<p>To gain more insights into similar issues of trademark disputes within the gaming industry, interested readers can explore further discussions at <a href=""https://www.ovigames.com/"" target=""_blank"" rel=""noopener""><strong>Ovi Games</strong></a>, where the complexities of game development, marketing, and legal challenges are frequently analyzed. Additionally, an ongoing case about how <a href=""https://www.kizi10.org/blog/sony-pushing-bungie-to-treat-destiny-2-more-like-a-business-is-beneficial-says-former-studio-lawyer"" target=""_new"" rel=""noopener"">Sony is pushing Bungie to treat Destiny 2 more like a business</a>, detailed on Kizi10, reflects the broader industry trend of balancing creative integrity with commercial imperatives, further complicating the landscape in which these disputes occur.</p>
<p>As the case develops, the gaming community and multimedia sectors alike will be watching closely, aware that the outcome could set important precedents for trademark disputes and digital marketing strategies in the future.</p>","2024-09-26","3"
"34","'Day Before' Developers Reappear, Once Again Seeking Financial Contributions","day-before-developers-reappear-once-again-seeking-financial-contributions","/blog-img/Day_Before.jpg","<p>Fntastic, the Singapore-based studio behind the tumultuous launch of ""The Day Before,"" which led to its brief closure, has resurfaced with a plea for a second chance—and your financial support. The comeback centers around a Kickstarter campaign launched to revive the studio and fund its new project, ""Escape Factory,"" a cooperative multiplayer game.</p>
<p>The reappearance of Fntastic on social media platforms like X/Twitter has been marked by an announcement linking to a comprehensive website detailing their recovery plan and next steps. This includes a frequently asked questions section, a recovery plan PDF, contact information, a business page, and more. The site also hosts a Discord server with moderators claiming to be Fntastic developers, adding a layer of interaction with the gaming community.</p>
<p>Skeptics might question the authenticity of this resurgence, considering the studio's rocky history. However, the elaborate setup of the new website and its extensive information suggest a serious attempt at a comeback. The website includes links to a Steam page for ""Escape Factory,"" where a free demo is available, and the Kickstarter campaign aims to raise $15,535. At the time of writing, the campaign had garnered $139 from three backers.</p>
<p>Fntastic's new initiative arrives amidst lingering doubts following the disaster of ""The Day Before,"" a game so negatively received that the servers were shut down just over a month after launch. The studio issued refunds and faced significant backlash from fans and critics alike. The website addresses these concerns head-on, apologizing for past mistakes and outlining significant internal changes aimed at professionalizing their operations.</p>
<p>The website stresses a renewed commitment to honesty, transparency, and community engagement. It notes that Fntastic has lost all legal rights to both ""The Day Before"" and ""Propnight,"" another game developed before the closure, and details lessons learned from the debacle. The studio acknowledges overly ambitious goals with a low indie budget, a lack of experience with AAA technology, and overly embellished marketing as key factors in their previous failure.</p>
<p>For more details on the evolution of this intriguing saga in the gaming industry, including insights into other games and studio updates, interested readers can visit related articles on classic and new games at <a href=""https://www.kizi10.org/blog/louisiana-company-sues-playstation-shift-up-over-stellarblade-name-dispute"" target=""_new"" rel=""noopener"">Kizi 10</a> and <a href=""https://www.crazygamesonline.com/blog/next-week-suicide-squad-kill-the-justice-league-introduces-new-character-lawless"" target=""_blank"" rel=""noopener"">Crazy Games Online</a>.</p>
<p>Despite past controversies, the stated mission of the resurrected Fntastic emphasizes a pivot towards a more mature and responsible approach to game development and community interaction. As the studio navigates these waters, the gaming community will be watching closely to see if Fntastic can indeed turn a new leaf and deliver on its promises without repeating the mistakes that nearly led to its demise.</p>
<p>The re-emergence of Fntastic and their new project represents a critical juncture not only for the studio but also for the broader gaming community's reception of developer comebacks after significant failures. The call for community support through Kickstarter, coupled with the release of a free demo for ""Escape Factory,"" signals a strategic shift towards transparency and direct engagement with potential players. This approach is designed to rebuild trust and demonstrate their commitment to delivering a quality gaming experience.</p>
<p>The ""Escape Factory"" project is positioned as a litmus test for the effectiveness of Fntastic's internal reforms and their ability to adapt to the high standards expected in the current gaming landscape. By focusing on smaller, achievable project goals and leveraging direct community feedback, Fntastic hopes to mitigate past oversights and align their development processes more closely with player expectations.</p>
<p>Furthermore, the studio’s detailed communication about their past errors and the specific changes they’ve implemented suggests a move towards greater accountability. This includes abandoning their previous practice of relying on volunteer developers and committing to a fully professional approach to game development.</p>
<p>As Fntastic attempts to navigate its way back into the good graces of the gaming world, the success of ""Escape Factory"" and the Kickstarter campaign will be telling. Will the gaming community be willing to give Fntastic a second chance, or has the trust been irreparably damaged by ""The Day Before""? Only time will tell, but the outcome will certainly provide valuable lessons for other developers in the industry on the importance of transparency, community engagement, and the ability to learn from one’s mistakes.</p>","2024-10-01","3"
"35","Diablo 4: Vessel of Hatred Expansion Review","diablo-4-vessel-of-hatred-expansion-review","/blog-img/Diablo_4.jpg","<p>""Diablo 4: Vessel of Hatred"" brings a fresh and invigorating twist to Blizzard's iconic action RPG series, continuing the sinister journey into the depths of demonic warfare. The expansion plunges players into the eerie and unexplored terrains of Nahantu, filled with dense forests and murky swamps, promising a mix of thrill and challenge that fans of the series eagerly anticipate.</p>
<p>The storyline picks up seamlessly from the suspenseful finale of Diablo 4, with the Daughter of Hatred defeated and the chaos following the disappearance of a soulstone imbued with Mephisto’s essence. This roughly six-hour narrative adventure, while engaging, leaves players on the edge with its abrupt cliffhanger, hinting at darker events yet to unfold. While the campaign might feel brief and somewhat underdeveloped, the rich lore and intriguing character arcs woven throughout the journey compensate, drawing players deeper into the game’s dark world.</p>
<p>Diablo 4 set a high bar with its compelling gameplay and immersive world-building, as noted in Travis Northup’s review from May 30, 2023. The base game was lauded for its near-perfect endgame design and progression, which made departing from its addictive loops a challenging feat. ""Vessel of Hatred"" builds on these strengths, refining the leveling system and enhancing the loot dynamics to enrich player experience. The cap on leveling has been adjusted to 60 with an additional 300 overleveling opportunities, allowing players to delve into endgame scenarios sooner and engage more deeply with each character’s build potential through intricate paragon perk trees.</p>
<p>One of the standout additions in this expansion is the innovative mercenary system. This feature allows solo adventurers to hire NPC heroes for companionship and assistance in their quests. Characters like Subo, the sharpshooting bounty hunter, and Aldkin, a demon child with formidable powers, not only add to the combat dynamics but also bring their own stories and quests that enrich the gameplay experience. Their development through shared adventures adds a layer of strategy and personal connection to the game, making every encounter more meaningful.</p>
<p>The introduction of the Spiritborn class is a highlight of the expansion. This new character class offers a blend of tribal magic and warrior skills, allied with spectral guardians each bestowing unique abilities. Players can customize their Spiritborn avatars by combining different spirit skills, allowing for a versatile approach to combat whether they prefer tanking with the gorilla spirit’s thorny defenses or dealing high DPS with the jaguar spirit’s swift attacks. This flexibility makes the Spiritborn class a thrilling addition for players who enjoy experimenting with different strategies and builds.</p>
<p>The expansion also introduces a captivating endgame activity: the Dark Citadel. This cooperative challenge pits players and their friends against formidable bosses and intricate puzzle mechanics across various fortress wings. Although it's an initial offering in such large-scale co-op activities for Diablo, the Dark Citadel sets a promising precedent with its engaging mechanics and rewarding loot system, despite the straightforward nature of its puzzles.</p>
<p>""Diablo 4: Vessel of Hatred"" also marks an improvement in social gameplay mechanics with the introduction of the Party Finder feature, facilitating easier formation of groups for tackling high-level content like the Dark Citadel. This is a timely addition, enhancing the cooperative aspect of the game, which becomes particularly relevant given the expansion’s focus on team-oriented challenges.</p>
<p>Despite these enhancements, the expansion is not without its flaws. Players have encountered stability issues, including multiple crashes and bugs that occasionally mar the gameplay experience. These technical hiccups, alongside an underwhelming main campaign narrative, might detract from the overall enjoyment but do not overshadow the expansion’s robust offerings.</p>
<p>In the midst of exploring ""Vessel of Hatred,"" the gaming community also turned its attention to other notable developments. Recently, the developers behind the anticipated title ""Day Before"" made headlines as they reappeared to seek further financial contributions. <a href=""https://www.kizi10.org/blog/day-before-developers-reappear-once-again-seeking-financial-contributions"">Learn more about this development</a>.</p>
<p>Another intriguing development in the gaming industry is the release of ""Zelda: Echoes of the Wisdom,"" which notably is the first in the series developed without the direct involvement of Shigeru Miyamoto.Explore this new chapter in the Zelda <a href=""https://www.freecrazygames.io/blog/zelda-echoes-of-the-wisdom-the-first-without-shigeru-miyamoto"" target=""_blank"" rel=""noopener""> free crazy games online</a>.</p>
<p>Moreover, fans of survival horror can look forward to ""Defending Alien Isolation,"" a game that promises to redefine the boundaries of fear and survival in an extraterrestrial environment. <a href=""https://www.bestcrazygames.com/blog/defending-alien-isolation"" target=""_blank"" rel=""noopener"">Read more about this thrilling game</a>.</p>
<p>""Diablo 4: Vessel of Hatred"" enriches the Diablo universe with its strategic enhancements and new content, ensuring that fans will have plenty of reasons to return to the battle-scarred realms of Sanctuary. Despite some narrative and technical shortcomings, the expansion offers a robust platform for both new adventures and revisiting old battles, making it a worthy addition to the beloved series.</p>","2024-10-09","3"
