"id","title","url","image_url","post","date_created","category"
"23","Stellar Blade Studio Shares Update on PC Version: What We Know So Far","stellar-blade-studio-shares-update-on-pc-version-what-we-know-so-far","/blog-img/Stellar_Blade_Studio_Shares_Update_on_PC_Version_What_We_Know_So_Far.jpg","<p>The anticipation for the PC version of Stellar Blade continues to grow as fans eagerly await the next chapter of this action-adventure hit. Since its launch in April, Stellar Blade has maintained a strong and dedicated community, a testament to its enduring appeal. Despite not yet reaching its first anniversary, the game remains a significant player in the gaming world, thanks in part to the continuous updates from its developer, Shift Up. One of the most exciting developments came last July, and now we have even more news to share.</p>
<h3>Stellar Blade's Journey and Community</h3>
<p>April marked the debut of Stellar Blade, a game that quickly captured the hearts of many players. While it's only been a few months since its release, the game's community remains as engaged as ever. Shift Up has done an excellent job of keeping the momentum going with regular updates, each one enhancing the gameplay experience and keeping players invested in the world of Stellar Blade.</p>
<h3>What's Next for Stellar Blade?</h3>
<p>PlayStation has another hit on its hands with Stellar Blade, a game that has now joined the ranks of iconic titles featuring characters like Ellie from The Last of Us and Kratos from God of War. The game’s protagonist, EVE, has already made her mark in the action-adventure genre, and there’s no sign of things slowing down. Discussions about potential collaborations, a sequel, and the highly anticipated PC version of the game have been circulating, creating even more buzz among the fanbase.</p>
<p>""Stellar Blade,"" a highly anticipated action RPG, has garnered attention for its stunning visuals, compelling narrative, and intense combat mechanics. The game's review on IGN highlights both its strengths and weaknesses. The visuals are lauded for their detail and creativity, while the combat system, though intricate, may feel repetitive to some players. However, the narrative depth and character development offer a rich experience for those who enjoy story-driven games.</p>
<p>For an in-depth review, you can visit the <a href=""https://www.ign.com/articles/stellar-blade-review"" target=""_blank"" rel=""noopener"">IGN review here</a>.</p>
<h3><strong>Stellar Blade on PC: The Latest Update</strong></h3>
<p>For those eagerly awaiting the PC version of Stellar Blade, there’s good news. Shift Up recently released its Q2 2024 financial report, which included some exciting details about the game’s future. According to the report, the developers are ""preparing for its release on PC"" as part of their strategy to ""continue the excitement of Stellar Blade."" While a specific release date has not been provided, the team at Shift Up hinted that the PC version could arrive in the ""near future.""</p>
<p>Interestingly, Shift Up also expressed confidence that the PC version of Stellar Blade will perform even better than its console counterpart. This optimism is based on the broader reach and capabilities of PC gaming, which could potentially introduce the game to an even larger audience.</p>
<h3><strong>Stellar Blade's Success and Future Plans</strong></h3>
<p>Since its launch on PS5, Stellar Blade has seen impressive success, with over a million copies sold worldwide by June 2024. While the latest report notes a slight decline in sales, the game continues to sell steadily, proving its lasting appeal.</p>
<p>But Shift Up isn’t stopping there. Alongside the PC version, the developer has big plans for the future of Stellar Blade. This includes the release of additional downloadable content (DLC), which promises to expand the game's universe and offer new experiences for players. A sequel is also in the works, which is sure to excite fans who are eager to see where EVE’s journey will take her next.</p>
<h3><strong>More Exciting Additions Coming Soon</strong></h3>
<p>In addition to the PC version and DLC, Shift Up has more in store for Stellar Blade fans. By the end of 2024, players can expect the introduction of a Photo Mode, allowing them to capture and share their favorite moments from the game. Moreover, a major collaboration is also on the horizon, although details about this remain under wraps for now.</p>
<h3>Stay Tuned for More Updates</h3>
<p>As we look forward to the future of Stellar Blade, one thing is clear: the game’s journey is far from over. With a PC version on the way, more content planned, and the possibility of a sequel, Shift Up is committed to keeping Stellar Blade at the forefront of the gaming world.</p>
<p>For those who want to stay informed, keep an eye on the latest updates from the development studio. Whether you’re a long-time fan or new to the world of Stellar Blade, there’s plenty to look forward to in the coming months.</p>
<p>Stay connected for the latest news and updates on Stellar Blade and other exciting games. The world of gaming is constantly evolving, and there’s always something new just around the corner.</p>
<p>For insights on gaming websites and recommendations for the best games to play, the article on Kizi10 offers a detailed guide. It discusses various gaming platforms and highlights top games across different genres, providing recommendations for casual gamers and enthusiasts alike. Whether you're into action, strategy, or puzzle games, this article has something for everyone.</p>
<p>To explore the full list and details, you can visit the <a href=""https://www.kizi10.org/blog/gaming-website-and-the-best-games-to-play"" target=""_new"" rel=""noopener"">Kizi10 blog post</a>.</p>","2024-08-22","3"
"24","PS5 Pro Leak Reveals Rumored Name and Design of Upcoming Console","ps5-pro-leak-reveals-rumored-name-and-design-of-upcoming-console","/blog-img/PS5_Pro_Leak_Reveals_Rumored_Name_and_Design_of_Upcoming_Console.jpg","<p>A recent report on the PS5 Pro has uncovered new, unannounced details about the anticipated console. According to an article published on Dealabs, the reliable PlayStation leaker known as billbil-kun has revealed that the name of the upcoming mid-generation refresh is indeed PS5 Pro. The report also includes a sketch of the console's design, based on what is claimed to be the final packaging box for the new system.</p>
<p>The sketch shows a console design similar to the current PS5 Slim, featuring a white color scheme, two USB-C ports, and a power button on the front. However, the PS5 Pro is distinguished by three black stripes in the center of its outer layer, a detail not found on the base models. Billbil-kun notes that the PS5 Pro appears to be slightly thicker than the PS5 Slim. Additionally, the PS5 Pro depicted in the leak does not include a disc drive, raising questions about whether Sony plans to release a version with a disc drive in the future. The price remains unmentioned, and the controller is still the basic DualSense model.</p>
<p>Billbil-kun anticipates that Sony will officially announce the PS5 Pro during the first half of September 2024. IGN has reached out to Sony for comments on these developments. For more information on the PS5 Pro leak, you can visit IGN's detailed article <a href=""https://www.ign.com/articles/ps5-pro-leak-reveals-alleged-name-and-design-of-the-console?utm_campaign=trueAnthem:+Manual&utm_medium=trueAnthem&utm_source=facebook&fbclid=IwZXh0bgNhZW0CMTEAAR3xdjVz337yNa8t3ShCvAeFzOTcYHtO3x4Wi9Z7OfGi5CofznUTl_uB-kw_aem_LEzXa8JHP9b0hEYkK-Opfg&sfnsn=scwspwa"" target=""_blank"" rel=""noopener"">here</a>.</p>
<p>Rumors about a PS5 Pro have been circulating for some time, and reports suggest that the console might be released in November. Earlier this year, alleged PS5 Pro specifications were leaked online, which IGN considers credible. These leaks indicate several significant upgrades, including a CPU that remains similar to the PS5’s standard model but with a ""high-frequency CPU mode,"" boosting the clock speed by 10% to 3.85 GHz. The GPU is expected to deliver faster rendering and higher-quality ray tracing, with 33.5 teraflops compared to the PS5's 10.28 teraflops. A direct comparison suggests that the PS5 Pro could offer between 16 and 17 teraflops.</p>
<p>Additionally, the PS5 Pro is rumored to feature a scaling and anti-aliasing solution known as PSSR (PlayStation Spectral Super Resolution Upscaling), a custom machine learning architecture, and an AI accelerator. The console is also expected to come with a removable disc drive and 1 TB of storage.</p>
<p>This ""power-enhanced"" update is designed to boost interest in the PS5 before the highly anticipated release of Grand Theft Auto 6 in 2025. As previously reported, the stakes are high for GTA 6, and not just for Rockstar and Take-Two.</p>
<p>Sony has experience launching Pro versions of its consoles, with the PS4 Pro releasing in November 2016, three years after the original PS4. The PS5 Pro is expected to launch four years after the PS5’s debut in November 2020.</p>
<p>The PS5 Pro’s release comes at a time when PS5 sales have been declining. In May, Sony stated that PS5 sales had peaked and the console was entering ""the final phase of its lifecycle.""</p>
<p>For those interested in more gaming news, check out the latest update on the PC version of Stellar Blade <a href=""https://www.kizi10.org/blog/stellar-blade-studio-shares-update-on-pc-version-what-we-know-so-far"">here</a>.</p>
<p> </p>","2024-09-02","3"
"25","Ubisoft Stock Declines as Analysts Anticipate Disappointing Sales for Star Wars Outlaws","ubisoft-stock-declines-as-analysts-anticipate-disappointing-sales-for-star-wars-outlaws","/blog-img/Star_Wars_Outlaws.jpg","<p>Ubisoft has experienced a notable decline in share price after the release of Massive Entertainment's Star Wars Outlaws, the first open-world title in the Star Wars gaming franchise. Since its launch on August 27, Ubisoft’s stock has plummeted by 12.6%, dropping to a near-decade low of 15.22 euros, leaving the company with a market valuation of approximately 1.96 billion euros.</p>
<p>Star Wars Outlaws was anticipated to be a significant boost for Ubisoft's financial performance. However, the company chose not to set specific sales targets before the game's release, a decision that might have contributed to the uncertainty impacting its stock value. Despite receiving favorable reviews, with IGN giving the game a score of 7/10 for its engaging narrative and expansive exploration tempered by simplistic stealth and repetitive combat, the game has not met sales expectations. Daniel Kerven, an analyst at J.P. Morgan, noted that Star Wars Outlaws had fallen short of projected sales figures despite its positive critical reception.</p>
<p>The financial outlook for Star Wars Outlaws has been adjusted downward, with projected sales now set at 5.5 million units for the fiscal year ending in March 2025, a decrease of two million units. This revision comes despite the game’s development budget being significantly higher—by at least 30%—than that of last year’s Assassin's Creed Mirage. Twitch streaming data also indicates that Star Wars Outlaws is underperforming compared to Mirage by about 15%.</p>
<p>In addition to the challenges faced by Star Wars Outlaws, Ubisoft is also grappling with the performance of Xdefiant, a free-to-play title positioned as a competitor to Call of Duty. Charles-Louis Planade, an analyst with Midcap Partners, reported to Reuters that Xdefiant has garnered less interest than anticipated after a strong initial launch in May.</p>
<p>The pressure is now mounting on Ubisoft's upcoming release, Assassin’s Creed Shadows, scheduled for November. This title is now expected to play a crucial role in recovering the company's financial health. Ubisoft’s performance will be closely watched in the coming months, with its second-quarter earnings report due in October.</p>
<p>For further insights into the gaming industry, including leaks and rumors about upcoming consoles, visit <a href=""https://www.kizi10.org/blog/ps5-pro-leak-reveals-rumored-name-and-design-of-upcoming-console"">PS5 Pro Leak Reveals Rumored Name and Design</a> or refer to Ubisoft’s detailed analysis at <a href=""https://www.ign.com/articles/ubisoft-shares-take-a-hit-as-analysts-predict-lower-than-expected-star-wars-outlaws-sales?utm_campaign=trueAnthem:+Manual&utm_medium=trueAnthem&utm_source=facebook&fbclid=IwZXh0bgNhZW0CMTEAAR2P8pi6UzH1q3W8gIT1oq_619a_XRalWqqLiOtF5DcFe1GRXhpYevqBm2U_aem_PvZaQXA8bsHyziLhKW2iyQ&sfnsn=scwspwa"" target=""_blank"" rel=""noopener"">IGN's coverage of Ubisoft’s recent challenges</a>.</p>
<p>Ubisoft's trajectory in the near term will likely be a subject of keen interest and speculation within the gaming community and among investors, highlighting the significant impact of high-profile game releases on the financial dynamics of major players in the video game industry.</p>
<p>Ubisoft's current predicament underscores the volatile nature of the gaming industry, where high-budget projects can entail significant financial risks. The underwhelming performance of Star Wars Outlaws exemplifies the challenges faced by game developers in predicting market reception and achieving expected sales targets. This situation also reflects broader trends affecting gaming stocks globally, as companies navigate the unpredictable preferences of a diverse gaming audience.</p>
<p>Amidst these challenges, Ubisoft's strategic decisions in the coming months will be pivotal. The development and launch strategies of Assassin’s Creed Shadows are now more critical than ever. This game not only needs to resonate well with fans but also perform exceptionally to offset recent setbacks. Moreover, Ubisoft may need to reassess its approach to marketing and community engagement to ensure future titles capture and retain the interest of its global fan base.</p>
<p>Additionally, Ubisoft's response to feedback on Star Wars Outlaws and Xdefiant could serve as a case study in adaptive strategy within the industry. Enhancing game features, improving player engagement, and optimizing post-launch support are potential areas for Ubisoft to address in order to regain momentum and restore investor confidence.</p>
<p>As the gaming community and investors look to Ubisoft's next moves, the overarching narrative will revolve around its ability to adapt to market demands and innovate in ways that reignite growth and enthusiasm for its brand and products.</p>","2024-09-05","3"
"26","PS5 Pro vs. PS5: A Gameplay Performance Comparison","ps5-pro-vs-ps5-a-gameplay-performance-comparison","/blog-img/PS5_Pro_vs__PS5.jpg","<p>The release of the PlayStation 5 in November 2020 marked a significant leap forward in gaming technology, offering superior graphics, faster load times, and a host of new features that have captivated the gaming community. Now, with rumors swirling about the PS5 Pro, many gamers are wondering how the Pro version will compare to the standard PS5 in terms of gameplay performance. While the PS5 is already a powerhouse console, the PS5 Pro promises even more power and enhanced gaming experiences.</p>
<p>In this article, we’ll explore the differences between the PS5 and the anticipated PS5 Pro, focusing on how they compare in gameplay performance, graphics, and overall user experience.</p>
<h3><strong>1. Graphics and Visuals</strong></h3>
<p>The PS5 has already impressed players with its ability to render stunningly detailed graphics. With the power of ray tracing, the console can simulate realistic lighting, reflections, and shadows, offering an immersive experience in visually complex games. Titles like <em>Demon’s Souls</em> and <em>Ratchet & Clank: Rift Apart</em> have demonstrated the console’s capacity for next-gen graphics.</p>
<p>The PS5 Pro is expected to take these visual improvements even further. Early rumors suggest the Pro version will support native 4K gaming at higher frame rates, possibly even targeting 8K resolution in some instances. This could mean crisper textures, more detailed environments, and a smoother experience overall. While the PS5 supports dynamic 4K resolution that adjusts based on the intensity of the game, the PS5 Pro could deliver native 4K across the board, ensuring games look their absolute best, no matter the circumstances.</p>
<p>For gamers who have a 4K or 8K television, the PS5 Pro could be a game-changer, offering the most visually stunning gaming experience possible on consoles. This would not only make environments in games look more realistic but also enhance the clarity of characters, objects, and effects within the game.</p>
<h3><strong>2. Performance and Frame Rates</strong></h3>
<p>One of the biggest benefits the PS5 offers over the previous generation is improved performance, with many games running at 60 frames per second (fps) in 4K. This makes for smoother animations and a more responsive feel, especially in fast-paced action games. The PS5 also allows some titles to reach 120 fps at lower resolutions, making it a strong contender for competitive gaming where every millisecond matters.</p>
<p>The PS5 Pro is expected to build on this with even more robust hardware, enabling games to run at 60 fps or higher in 4K with less compromise on graphics. For competitive gaming, the ability to push 120 fps in more games at higher resolutions could provide a notable edge, particularly in online multiplayer games where speed and precision are critical.</p>
<p>Additionally, the Pro version may also improve the performance of virtual reality (VR) games. Sony has already confirmed that the PSVR2 headset is in development, and the extra processing power of the PS5 Pro could make a noticeable difference in delivering smoother VR experiences with higher fidelity graphics.</p>
<h3><strong>3. Load Times and SSD Improvements</strong></h3>
<p>The PS5 introduced a custom SSD that dramatically reduces load times, allowing players to jump into games much faster than on previous consoles. Games like <em>Spider-Man: Miles Morales</em> showcase this feature well, with near-instantaneous fast travel between different areas of the game world. This has been one of the most praised features of the PS5, and it significantly enhances the overall gaming experience.</p>
<p>The PS5 Pro is expected to keep the SSD but possibly with some upgrades. Faster read speeds could lead to even shorter load times and improved texture streaming, which would allow games to load higher-quality assets on the fly without stuttering or frame drops. This would be particularly beneficial in open-world games, where vast environments and detailed textures can put a strain on the console’s hardware.</p>
<p>For example, in expansive worlds like those seen in <em>The Witcher 3</em> or the upcoming <em>Star Wars Outlaws</em>, reducing load times between areas or eliminating them entirely would allow for a more seamless and immersive experience. For more details on how upcoming games like <em>Star Wars Outlaws</em> could affect the gaming market, check out this article on <a href=""https://www.kizi10.org/blog/ubisoft-stock-declines-as-analysts-anticipate-disappointing-sales-for-star-wars-outlaws"" target=""_new"" rel=""noopener"">Ubisoft's performance concerns</a>.</p>
<h3><strong>4. Backward Compatibility and Game Library</strong></h3>
<p>The PS5 is backward compatible with most PS4 games, allowing players to enjoy their existing library of titles with enhanced performance and graphics. This feature has been a major selling point for the PS5, as it provides gamers with a wealth of content right from the start.</p>
<p>It is likely that the PS5 Pro will maintain full backward compatibility with PS4 and PS5 games, while also potentially offering performance boosts for existing titles. Games that struggled to maintain steady frame rates or had long load times on the PS5 could see improvements on the PS5 Pro. This would make the Pro version appealing not only for new games but also for revisiting older titles with a fresh coat of polish.</p>
<h3><strong>5. Price and Availability</strong></h3>
<p>One of the biggest factors in determining whether to upgrade to the PS5 Pro will undoubtedly be its price. The PS5 already comes in two versions: the standard disc-based model and the cheaper, digital-only edition. The PS5 Pro, with its expected hardware upgrades, is likely to come with a higher price tag than the current models. However, for gamers who prioritize performance and the best possible experience, the Pro version may be worth the investment.</p>
<p>The availability of the PS5 has been a significant issue since its launch, with many players struggling to get their hands on a console due to high demand and supply chain issues. It remains to be seen whether the PS5 Pro will face similar challenges, but it's likely that demand for the upgraded version will be high, especially among dedicated gamers.</p>
<h3><strong>Conclusion</strong></h3>
<p>The PS5 Pro promises to build on the impressive foundation laid by the PS5, offering enhanced performance, better visuals, and faster load times. For gamers who want the ultimate console gaming experience, especially those with 4K or 8K displays, the Pro version could be the ideal choice. However, the PS5 is still an exceptional console that delivers a powerful next-gen experience, and for most players, it will continue to provide plenty of entertainment for years to come.</p>
<p>Whether you're planning to stick with the PS5 or wait for the PS5 Pro, both consoles are set to deliver top-tier gaming experiences that will push the boundaries of what’s possible in the world of gaming.</p>","2024-09-11","3"
