"id","title","url","image_url","post","date_created","category"
"27","Major PS5 Update Introduces Welcome Hub, Party Share, and Additional New Features","major-ps5-update-introduces-welcome-hub-party-share-and-additional-new-features","/blog-img/Major_PS5_Update_.jpg","<p>Sony has recently unveiled a significant PS5 system update that introduces a suite of exciting features, enhancing the overall user experience. This latest update, version 24.06-10.00.00, has been detailed by Hiromi Wakai, VP of Product Management at Sony Interactive Entertainment, in a recent post on the PlayStation Blog. The patch notes have also been published on the PlayStation website, providing a comprehensive look at what players can expect.</p>
<p>One of the standout additions is the Welcome Hub, a new feature designed to personalize the PS5 home screen. The Welcome Hub offers customizable widgets and backgrounds, allowing players to tailor their interface to their preferences. This new hub replaces the Explore tab, previously available only in the U.S., and is set to roll out globally over the next few weeks. Initially, it will be available to select players in the U.S., with a broader release planned shortly thereafter.</p>
<p>Another major feature is Party Share, which expands the social connectivity options for PS5 users. This feature enables players to invite friends to join their party voice chat through a simple link, even if those friends are not added on the PlayStation Network. By generating a QR code or sharing a party link, users can seamlessly integrate friends into their gaming sessions, enhancing the communal aspect of gaming.</p>
<p>The update also brings several other notable enhancements:</p>
<ul>
<li><strong>Personalized 3D Audio Profiles</strong>: Users can now create tailored 3D audio profiles for headphones, optimizing the sound to individual hearing preferences. This feature promises a more immersive audio experience than ever before.</li>
<li><strong>Adaptive Charging</strong>: Available for the newer PS5 models, this feature conserves energy by adjusting the power supply during rest mode based on the controller’s battery level.</li>
<li><strong>Remote Play Settings</strong>: Users can now select which individuals are allowed to connect to their PS5 console via Remote Play, adding an extra layer of security and customization.</li>
</ul>
<p>Despite these enhancements, the update does not include themes or folders, features that many PS5 owners have been eagerly anticipating. The absence of these elements has been noted by the community, though the new features have generally been well-received.</p>
<p>Additionally, the release of this update follows closely on the heels of the announcement of the PS5 Pro, set to launch on November 7 at a price of $700. The PS5 Pro, which will not include a disc drive, has already sparked an increase in sales for the existing PS5 Disc Drive, suggesting robust market interest.</p>
<p>This latest update not only aims to refine the user experience with new functionalities but also demonstrates Sony's commitment to evolving the PS5 platform to meet user demands and market trends. As these features roll out, players around the globe are sure to find new ways to customize their gaming setup, engage with friends, and enjoy their favorite games on the PlayStation 5.</p>
<p>For more insights into how the gaming market is responding to new releases and updates, consider reading about the recent performance of Ubisoft's stock in relation to anticipated game sales, available in a detailed article here: <a href=""https://www.kizi10.org/blog/ubisoft-stock-declines-as-analysts-anticipate-disappointing-sales-for-star-wars-outlaws"" target=""_new"" rel=""noopener"">Ubisoft Stock Declines as Analysts Anticipate Disappointing Sales for Star Wars Outlaws</a>.</p>
<p>The PS5 system software update is a clear indication of Sony's commitment to refining and expanding its console capabilities to better serve its diverse user base. The introduction of the Welcome Hub marks a significant shift towards a more personalized gaming experience. Players can now customize their console interface to reflect their preferences and interests, something that resonates well in today's customization-focused consumer culture. The ability to display relevant information such as storage space, battery levels, and friend activity through customizable widgets can make the gaming experience more intuitive and user-friendly.</p>
<p>Additionally, the Party Share feature enhances the social interaction capabilities of the PS5, allowing gamers to connect with friends more fluidly. This feature is especially pertinent in today’s gaming culture where community and social interactions play a critical role in the overall experience. By allowing gamers to invite friends into voice chats with a simple link, Sony is facilitating a more connected and inclusive environment.</p>
<p>These updates, combined with the adaptive charging and detailed audio personalization options, position the PS5 as a cutting-edge platform that's adaptable to the specific needs and preferences of its users. While some may be disappointed by the lack of themes or folders, the ongoing enhancements and new features continue to make the PS5 a compelling choice for gamers seeking a rich, immersive, and personalized gaming environment.</p>","2024-09-12","3"
"28","Rare PS2 Horror Game Sees Significant Price Drop","rare-ps2-horror-game-sees-significant-price-drop","/blog-img/PS2_Horror_Game.jpg","<p>The <strong>PS5 Pro</strong> has generated a lot of buzz in the gaming community, and many are comparing its gameplay and performance to the original <strong>PS5</strong>. With improved hardware and enhanced features, gamers are eager to see how the <strong>PS5 Pro</strong> stacks up against its predecessor. In this <strong>PS5 Pro vs PS5</strong> comparison, we’ll dive into key performance differences, including gameplay, graphics, and overall user experience. For more in-depth insights, check out this article on <strong>PS5 Pro vs PS5: A Gameplay Performance Comparison</strong> on <a href=""https://www.kizi10.org/blog/ps5-pro-vs-ps5-a-gameplay-performance-comparison"" target=""_new"" rel=""noopener"">Kizi10</a>.</p>
<p>While modern gaming consoles like the PS5 are often in the spotlight, retro gaming is still thriving, particularly when it comes to rare and collectible titles. A recent example is the ultra-rare <strong>PS2 horror game Rule of Rose</strong>, which has recently seen a significant drop in price. The game, notorious for its disturbing content and controversial release, was originally banned in the UK, transforming it into a collector’s item over the years.</p>
<p><strong>Rule of Rose</strong> has been highly sought after, especially in Europe, where it was once selling for prices upwards of $600. The survival horror game, released in 2006 in the United States and Japan, developed a cult following due to its unique gameplay and controversial storyline. The plot centers around Jennifer, a young woman kidnapped by a group of aristocratic girls, and forces players to navigate her psychological trauma in a 1930s English setting. Despite its intriguing premise, the game faced criticism for its disturbing content, which led to its ban in several regions.</p>
<p>In a surprising turn of events, a group of sellers in Italy recently unearthed a shipment of sealed <strong>Rule of Rose</strong> copies, significantly reducing the game's previously sky-high prices. These newly discovered copies are currently listed for about €230 ($250) on platforms like eBay, which is less than half of what collectors were paying before. As with many rare retro games, the supply is limited, and with stock dwindling, prices are expected to rise again soon. Those interested in securing a copy of <strong>Rule of Rose</strong> are encouraged to act quickly, as demand is high among retro game collectors.</p>
<p>This discovery of <strong>Rule of Rose</strong> sealed copies is reminiscent of other rare gaming finds, such as the highly coveted <strong>Nintendo PlayStation controller prototype</strong> that recently sold at auction. These types of retro game discoveries excite collectors and often lead to a resurgence in interest in older gaming titles. Whether it’s a rare PS2 horror game or a unique piece of gaming history like the Nintendo PlayStation prototype, these items remind us of the enduring value of classic video games.</p>
<p><strong>Rule of Rose</strong> is often compared to other survival horror games like <strong>Silent Hill</strong> due to its atmospheric visuals and psychological horror elements. Its focus on tension and fear, rather than action, places it alongside other classic survival horror titles such as <strong>Alone in the Dark</strong>, which shares a historical setting with <strong>Rule of Rose</strong>. The latter’s storyline, set in 1930s England, also adds a unique historical dimension to its horror elements, making it a standout in the genre despite its controversial nature.</p>
<p>As retro games continue to hold value in the gaming community, the story of <strong>Rule of Rose</strong> is a reminder that many classic titles can suddenly reappear and influence the market. Whether you’re a casual gamer or a dedicated collector, the world of retro gaming offers endless surprises. If you're a fan of gaming and want to see how modern consoles compare, don’t forget to read the full comparison of <strong>PS5 Pro vs PS5: A Gameplay Performance Comparison</strong> on Kizi10.</p>
<p>From the fast-paced technological advancements in consoles like the <strong>PS5 Pro</strong>, to the unexpected resurgence of retro games like <strong>Rule of Rose</strong>, the gaming world is constantly evolving.</p>","2024-09-13","3"
"29","Warhammer 40,000: Space Marine 2 Fans Speculate on the Next Enemy Faction for Space Marine 3","warhammer-40000-space-marine-2-fans-speculate-on-the-next-enemy-faction-for-space-marine-3","/blog-img/Space_Marine_2.jpg","<p>With <strong>Warhammer 40,000: Space Marine 2</strong> now out for a little over a week, players have delved deep into its intense campaign and explored the co-op Operations mode and PvP battles in Eternal War. However, fans are already speculating about the next enemy faction that could appear in a highly anticipated sequel, <strong>Space Marine 3</strong>. Based on several hints scattered throughout <strong>Space Marine 2</strong>, one potential enemy stands out: the Necrons.</p>
<p><strong>Spoiler Alert for Warhammer 40,000: Space Marine 2!</strong></p>
<p>In <strong>Space Marine 2</strong>, players once again follow Titus of the Ultramarines as he battles the Tyranids and the Thousand Sons Traitor Legion. The campaign crescendos with a massive battle involving a demonic army and even includes a daring trip into the warp. With help from Ultramarines Chapter Master Marneus Calgar, Titus successfully fends off the combined threats, only to be sent on a mysterious mission, hinting at a sequel in the works.</p>
<p>Fans believe that <strong>Space Marine 3</strong>, which seems inevitable due to the breakout success of <strong>Space Marine 2</strong>, will feature the Necrons, the skeletal robot-like xenos of the Warhammer 40,000 universe. After battling Orks in <strong>Space Marine 1</strong> and facing Tyranids and Chaos in the sequel, the Necrons are the next logical adversary, and several in-game clues point to their appearance.</p>
<p>One mission in <strong>Space Marine 2</strong> sets the stage by taking Titus deep into an alien planet's ancient depths, where wall markings clearly reference the Necrons. There's even a dataslate (one of the game’s audio logs) hinting that Necron constructs have been killing Techpriests. These constructs, resembling Canoptek Tomb Stalkers, can be seen scattered across the area. This sets the tone for a larger encounter with the Necrons in a future sequel.</p>
<p>The storyline of <strong>Space Marine 2</strong> subtly revolves around the Necrons, with a rogue Techpriest trying to wield an ancient Necron artifact to close off the warp and nullify the influence of Chaos. While the Techpriest believes the artifact can achieve this, the Necrons may have their own plans. Given their 60-million-year slumber, it's safe to assume they’ll be quite displeased when they awaken to discover the Adeptus Mechanicus meddling with their ancient technology.</p>
<p>As speculation mounts, it's likely that Titus will be called back to defend the Imperium from both the Necrons and the forces of Chaos. Fans anticipate more brutal combat, exciting lore integration, and perhaps a cameo from Ultramarines Primarch Roboute Guilliman himself.</p>
<p>While <strong>Space Marine 3</strong> remains a future prospect, <strong>Space Marine 2</strong> has made an impressive impact. With over two million players, it has become the most-played <strong>Warhammer 40,000</strong> game of all time on Steam, surpassing even some of the fastest-selling games like <strong>Doom</strong>. As the game continues to grow with post-launch updates, DLC, and class matching improvements for co-op mode, the community eagerly awaits the next chapter in this epic saga.</p>
<p>In the meantime, fans of <strong>Warhammer 40,000</strong> can enjoy the ongoing success of <strong>Space Marine 2</strong>, but it’s also worth noting that the retro gaming market has its own surprises. Recently, the <strong>rare PS2 horror game Rule of Rose</strong> saw a significant price drop after unopened copies were discovered, making it more accessible to collectors and fans alike. You can read more about this intriguing development on <a href=""https://www.kizi10.org/blog/rare-ps2-horror-game-sees-significant-price-drop"" target=""_new"" rel=""noopener"">Kizi10’s blog</a>.</p>
<p>As <strong>Space Marine 2</strong> continues to dominate the Warhammer 40,000 gaming scene, players will have to wait for a story expansion or <strong>Space Marine 3</strong> to see if the Necrons will indeed rise from their tombs and challenge the might of the Ultramarines. Until then, the battle for the Imperium rages on, with fans eagerly looking forward to the next thrilling chapter in the <strong>Warhammer 40,000</strong> universe.</p>","2024-09-14","3"
"30","PS5 Pro’s $700 Price Tag Could Set a Dangerous Standard for Future Consoles","ps5-pros-700-price-tag-could-set-a-dangerous-standard-for-future-consoles","/blog-img/PS5_Pro’s.jpg","<p>The recent unveiling of the <strong>PS5 Pro</strong> by PlayStation has sparked significant debate, largely due to its eye-popping $700 MSRP. While the new features and performance enhancements are impressive, this price point could set a troubling precedent for the future of gaming consoles.</p>
<p>The $700 price tag for the PS5 Pro is already shocking, but when you factor in additional costs such as tax and the optional disc drive, the total cost could easily approach $900. This marks a dramatic shift in the console market, raising concerns about whether this could redefine what consumers expect to pay for next-gen gaming systems.</p>
<p>Historically, console gaming has been accessible to the masses, offering cutting-edge technology at a reasonable price. For instance, the <strong>PS4</strong>, released in 2013 for $400, was a significant leap forward in gaming technology and is still delivering incredible experiences nearly a decade later. The <strong>PS4 Pro</strong>, another mid-generation upgrade, was also priced at $400, providing substantial improvements without the hefty price tag we're now seeing with the PS5 Pro.</p>
<p>However, with the PS5 Pro, PlayStation seems to be signaling a transition toward consoles being seen as premium, high-end devices rather than mainstream, affordable entertainment systems. This shift could have far-reaching implications, potentially changing the way the entire industry operates.</p>
<p>One major concern is that owning a console becomes significantly more expensive over time. Beyond the initial purchase, gamers are expected to pay for online services like <strong>PS Plus</strong>, which costs about $80 per year. Add to that the cost of accessories like the <strong>DualSense controller</strong>, which now costs $75, and the financial burden of being a PlayStation gamer continues to climb. It seems like PlayStation is pushing the boundaries of how much it can charge its loyal fanbase, all while maintaining the extra costs that come with owning a console.</p>
<p>PlayStation's move toward more expensive hardware is reminiscent of when it introduced $70 AAA game titles, a move that quickly became the industry standard as other companies like <strong>EA</strong>, <strong>Ubisoft</strong>, and <strong>Nintendo</strong> followed suit. Now, with the release of the PS5 Pro at $700, PlayStation is testing the waters to see how far they can push console pricing.</p>
<p>You can explore more about the <strong>PS5 Pro vs PS5</strong> performance and the implications of these rising prices in this detailed comparison: <a href=""https://www.kizi10.org/blog/ps5-pro-vs-ps5-a-gameplay-performance-comparison"" target=""_new"" rel=""noopener""><strong>PS5 Pro vs PS5: A Gameplay Performance Comparison</strong></a>.</p>
<p>This price escalation trend isn’t limited to PlayStation. The upcoming <strong>Nintendo Switch 2</strong> is rumored to be more expensive than the original Switch, and <strong>Xbox</strong>, which has struggled in the hardware market recently, might follow suit. Instead of lowering prices to remain competitive, these companies may feel emboldened to match or exceed PlayStation’s pricing model.</p>
<p>This raises serious concerns about the future. Could we see the next generation of consoles, such as the <strong>PS6</strong>, debuting at $700 or more? The writing seems to be on the wall, especially given that PlayStation has continually raised prices this generation. Unlike past cycles where prices would typically drop after a few years, the PS5 has only gotten more expensive, with even accessories like the <strong>DualSense controller</strong> seeing price hikes.</p>
<p>The ripple effect of this pricing model could be enormous. If PlayStation is successful with the PS5 Pro’s $700 price tag, it’s likely other gaming companies will follow their lead, as we’ve already seen with the pricing of AAA games. This could lead to a future where console gaming is no longer the affordable entertainment option it once was, but rather a premium luxury reserved for those willing to pay top dollar.</p>
<p>Gamers could also face higher costs beyond the console itself. As companies look for more ways to maximize profits, the possibility of even more expensive games looms on the horizon. Already, there are discussions about future AAA titles launching for more than $70, and it's easy to see how the trend could extend to other aspects of gaming, from accessories to services.</p>
<p>In conclusion, the <strong>PS5 Pro</strong> marks a pivotal moment in the gaming industry. While it promises an unparalleled gaming experience, its $700 price tag could have long-lasting consequences, potentially pushing gaming consoles into the realm of premium, high-cost products. As consumers, we must consider how these price hikes will affect our access to future gaming systems, especially if this becomes the new standard for next-gen consoles. The question is, are gamers ready for this new era of high-priced consoles, or is this trend setting us up for a rude awakening?</p>","2024-09-16","3"
"31","PlayStation Consoles to Stay a ""Core"" Focus of Business, Says Co-CEO","playstation-consoles-to-stay-a-core-focus-of-business-says-co-ceo","/blog-img/PlayStation.jpg","<p>As Sony continues its expansion into the PC gaming market, with PC gaming growing in popularity globally, consoles will still play a critical role in PlayStation's business strategy. This assurance comes directly from Hideaki Nishino, CEO of Sony Interactive Entertainment's Platform Business Group, during an interview with Japanese publication Nikkei. Nishino and Hermen Hulst, who succeeded Jim Ryan as Co-CEOs of PlayStation following his retirement, are leading the charge to maintain PlayStation’s console-driven focus while exploring new opportunities in PC gaming.</p>
<p>Despite the increasing attention on platforms beyond consoles, Nishino emphasized that consoles, including the upcoming PS5 Pro, remain central to PlayStation’s future. In the interview, which was transcribed by Video Games Chronicle, Nishino made it clear that PlayStation’s gaming consoles will continue to be a priority when it comes to major game releases.</p>
<h3>Consoles Are Here to Stay</h3>
<p>Nishino highlighted the convenience consoles provide over other gaming platforms, such as PCs or mobile devices. He explained that, unlike PCs, which can be complicated to set up, and mobile games, which are often cluttered with ads, PlayStation consoles are designed for ease of use. “With PlayStation, once you turn it on, you can experience the content you bought straight away,” said Nishino, underscoring the plug-and-play nature of consoles that remains a key selling point.</p>
<p>He also mentioned the user-friendly nature of the PlayStation Store, where products are laid out in an intuitive manner, making it easy for consumers to find and purchase games. While PC marketplaces like Steam have become major players in the gaming space, PlayStation's store continues to offer a streamlined experience tailored for console users.</p>
<p>Even though consoles are still very much plug-and-play, there are minor obstacles for consumers, such as registering disc drives or creating accounts with publishers like Activision or Ubisoft. However, despite the competition from PC platforms like Steam, Sony remains dedicated to providing a unique and convenient experience for its console users.</p>
<h3>Sony’s Push into PC Gaming</h3>
<p>Although consoles are at the core of Sony's gaming strategy, Nishino was clear that the company is also looking to expand its presence in the PC gaming market. “We are trying to increase our share of the overall game market by developing content for PCs as well,"" Nishino said. He acknowledged that while consoles will remain the foundation of PlayStation’s business, expanding into other platforms, including PCs, allows Sony to reach a broader audience.</p>
<p>PlayStation has already seen success with its PC releases, particularly with live-service hit <strong>Helldivers 2</strong>, which achieved a peak of 458,709 players. This is a significant number, indicating the potential for PlayStation titles in the PC market. By diversifying across platforms, Sony aims to tap into a larger segment of the gaming market, potentially boosting revenue streams while still supporting their core console business.</p>
<h3>The PS5 Pro and Future Console Investments</h3>
<p>With the upcoming release of the PS5 Pro, Sony has reinforced its commitment to consoles as a primary avenue for gaming. As discussed by Nishino, the console market still provides unparalleled ease of access and seamless gameplay experiences for users, positioning it as a critical part of Sony's overall strategy. However, the upcoming PS5 Pro’s rumored $700 price tag has stirred some controversy. According to a recent analysis, this high price point could set a concerning precedent for future consoles【source】.</p>
<p>Still, despite the high price tag, the PS5 Pro is designed to offer cutting-edge performance, and Sony remains committed to delivering premium gaming experiences through its consoles. It will be interesting to see how the pricing of the PS5 Pro affects its adoption among players and whether this marks a trend toward more expensive gaming hardware in the future.</p>
<p>For more insights into how the PS5 Pro's pricing could shape the future of gaming consoles, check out this detailed analysis on the potential long-term impact of the <strong>PS5 Pro's $700 price tag</strong>: <strong><a href=""https://www.kizi10.org/blog/ps5-pros-700-price-tag-could-set-a-dangerous-standard-for-future-consoles"" target=""_new"" rel=""noopener"">PS5 Pro’s $700 Price Tag Could Set A Dangerous Standard For Future Consoles</a></strong>.</p>
<h3>Conclusion</h3>
<p>While Sony is making strides in the PC gaming market, consoles are set to remain a core focus of PlayStation's business. With upcoming releases like the PS5 Pro, Sony reaffirms its commitment to offering gamers an unparalleled, plug-and-play experience that can’t be replicated on other platforms. However, by also exploring the PC gaming market, Sony aims to reach a wider audience without compromising its console-focused roots. Whether through console or PC, PlayStation's approach ensures that gamers everywhere have access to high-quality, engaging experiences.</p>","2024-09-17","3"
