"id","title","url","image_url","post","date_created","category"
"1","Top best popular games on kizi1","top-best-popular-games-on-kizi1","/blog-img/512c32234.jpg","<p>The best web browser games can be outstanding little time-killers between video conferences and will not occupy your priceless storage space. You do not require a high-powered video gaming PC for these. There are numerous excellent games to play directly in your browser that are entirely free and simple to run. They don't usually include the flashiest visuals. However, many of these browser games are just downright fun. We've gotten together a checklist of several of the most influential games you can play without waiting on a download.</p>
<p><img src=""https://kizi10.org/uploads/images/blog/post-image-1634195740860.jpg"" alt=""top 10 best games on kizi"" width=""925"" height=""411"">Web browser games require nearly no initiative to start, and like locally installed games, there's probably something for everyone. There are great deals of multiplayer browser games, but numerous singleplayer ones are the early, free builds of games to be popular full releases. If you're prepared to go out there as well as kill a long time, these are the games you must play.<br><br>Are they seeking another thing? Internet browser games are mainly free to play. However, we can help you out with all the most effective free computer games, the most effective free games on Steam, and which games are accessible on the Epic Store.<br><br>BEST BROWSER GAMES RIGHT NOW<br>Canabalt - This one's a widely known boundless runner from the flash era that's still a heart-pounding response test. It does require Flash, which Adobe has reduced support for, so you'll probably need to explore your web browser setups to allow it.<br>Catan Universe - Catan is a timeless parlor game that's practically equally as excellent online. You'll wish to entice your typical board game chums right into a phone or Discord phone call to play with each other however they will not require an effective gaming PC to maintain up.<br>City Guesser - Watch first-person videos walking cities anywhere in the world and also attempt to think where you are.<br>Freeciv - You can play the open-source version of Civilization online with good friends right in your internet browser many thanks to the magic of HTML5.<br>Mackerelmediafish.com - Another goofy web browser project by Nathalie Lawhead, this has you exploring ancient sites to look for the truth regarding Mackerel Media Fish with the assistance of some net rodents.<br>Slither.io - Like the blob Katamari game agar.io, you consume dots to expand your serpent while defeating other player snakes. It's a little bit glossy and also prettier than agar.io as well.<br>BEST MULTIPLAYER BROWSER GAMES<br>If you're seeking something to have fun with chums-- particularly ones who aren't gaming on a high-end maker-- have a look at these web browser games you can play online with buddies. Some are huge stressful fights like Agario and also Slitherio, others are tabletop classics like Catan Online.<br><br>Agar.io<br>Best Browser Games: Agar.io<br><br>Though Agar.io looks simplistic, with graphics of tinted circles on a checker-lined background, it's remarkably tough. Your circle starts very little, but when you eat all of the little displayed dots around you, you come to be larger. As a little circle, you move promptly and are able to evade the larger circles attempting to eat you. When you grow, you need larger sections of food. To expand even more than these weak dots are allowing you to, you should eat the various other gamers.<br><br>Considering that smaller players move faster, you can split your circle into 2 different circles of equal mass. When splitting your circle, the new one will certainly shoot out, which is useful for enveloping the smaller sized player running away from you. These circles expand relying on what they consume as well as do not stay the very same size or move at the same speed. There are multiple settings, including group games. When a larger player gobbles you up, you have to restart as the smallest possible dot. The circle of life is harsh.<br><br>For various other comparable choices, try Hexar.io, Lordz.io, and Lasersharks.io!<br><br>Isleward<br>Best Browser Games: Isleward<br><br>Isleward doesn't resemble a multiplayer game at first. It's a low-res roguelike that has you selecting what personality you desire to play before disposing you by yourself into the city of Strathford. In Strathford you get your bearings, find out just how to queue up activities and also check out. There are additionally a couple of low-level beasts that you can discover as well as eliminate to level up.<br><br>Ultimately you'll encounter other individuals as well as with any luck encourage them to adventure with you. A celebration of various personalities is a lot more powerful than one player alone, and significantly a lot more fun. There's an universe to explore, lots of islands, and also whole lots of loot to find.<br><br>Slither.io<br>Best Browser Games: Slither.io<br><br>Advertisement<br>Similar to Agar.io, Slither.io has you hungry for little dots (this time ones that radiance) to grow bigger. The twist: you're a snake. Your body gets much longer in addition to slightly larger as you eat the numerous dots that are littered about. You aren't able to consume your adversaries, but if you time it well, you can compel an additional serpent to face your body.<br><br>This will certainly cause them to vanish, leaving tons of body dots to accumulate. Slither.io does also enable you to tailor the skin of your serpent, and also there are some amazing choices. Take into consideration pimping out your snake with a necklace that hangs as they slink.<br><br>For something similar with a twist, try powerline.io!<br><br>Kingdom of Loathing<br>Best Browser Games: Kingdom of Loathing<br><br>You're possibly knowledgeable about the style of Kingdom of Loathing, which has actually been going strong for several years. It's that sort of pseudo-mmo kind of point, securely installed in the internet user interface, with drop down menus letting you pick your strikes, and also web page refreshes for each new area. It's a little unsightly, yet Kingdom of Loathing isn't trying to be quite. It's doing well at being amusing. Really, truly funny.<br><br>Take, for circumstances, the courses. They make definitely no feeling, but they're amusing due to the fact that they're word play here based. So I'm a Sauceror. I fling warm sauce in people's faces, as well as they obtain damaged, since hot sauce truly hurts when it obtains in your face. Making less sense, they're Disco Bandits, who dance at their opponents, fuelled by guts. And also this is all before you end up in the Haiku Dungeon, where not just are all the summaries of your adversaries in Haiku, yet so are your strikes.<br><br>The entire game is consistently unreasonable as well as enjoyable, from the opponent kinds, to the style conventions it apes so cleverly. And also while you can not directly play with other individuals, you can steal their things, sign up with guilds as well as interact with them. So that's something.<br><br>Treasure Arena<br>Best Browser Games: Treasure Arena<br><br>This 16-bit adventure game has you fighting in a dungeon over beneficial treasure. There are 3 other players seeking to obtain an item of the pie, also. You can respawn as long as the moment is ticking away, however once you die you shed some of your gold. The objective of the game is to have the most gold when the moment is up.<br><br>Different power-ups likewise show up around the dungeon as well as can be utilized to keep on your own alive. You and also other online players aren't the only individuals socializing in this dungeon-- NPCs also protect the treasure and also will certainly attack on sight if you go near them. You have to locate extra powerful weapons to also have a possibility versus them.<br><br>It's currently advanced right into Super Treasure Arena as a full release too.<br><br>Battle Brokers<br>Best Browser Games: War Brokers<br><br>War Brokers is a first-person voxel group shooter. There are often objectives that theme combat rounds past straight deathmatch, like quiting the opponent releasing their rockets. It's currently broadened to include a battle royale mode also.<br><br>Battle Brokers has lots of various guns as well as makers for you to open and also make use of. Guns unlock over time, yet you do start with a pistol and also a rifle to protect yourself with. Vehicles such as helicopters as well as tanks can be discovered around the map, which you can obviously enter and control. If you log into an account, there are lots of little goals and benefits you can declare for playing. As well as the competition can be harsh-- it's specifically good if you desire a tough experience.<br><br>Advertisement<br>For more deathmatches, there's additionally Raid.land!<br><br>Town of Salem<br>Best Browser Games: Town of Salem<br><br>If you've ever played the parlor game Mafia or Werewolf, Town of Salem must feel familiar. This roleplaying game difficulties you to be a conniving phony and also misdirect various other gamers. Relying on who you are randomly cast as, you may be a townsperson (great), the mafia (poor) or neutrals.<br><br>If you're a townsperson, you need to track down mafia participants and quit them before they kill everybody in your town. There are several functions for each classification of player. Each of these various duties will certainly give you an one-of-a-kind capacity that you can use in the night phase of the game. In the evening, players intend out their moves and also make notes in their will. If they die in the night, the remaining players can utilize their wills to, ideally, achieve the goals you were meant to do! Town of Salem is rather complex to discuss, however you'll get the hang of it soon sufficient.<br><br>Wilds.io<br>Best Browser Games: Wilds.io<br><br>This hack and slash complies with the core concept of eliminating individuals you do not like the appearance of, as well as finding loot spread around the map. There are a number of different game modes but the most popular is Ruins, the default when you run the game.<br><br>Damages provides you the chance to explore an area as a member of one of 3 groups. You can kill various other gamers on different teams, break boxes, as well as locate loot. Allow's be honest-- who does not such as more loot? Shield, potions, and also new weapons will certainly aid you survive longer in this desert wasteland. Your main purpose is to acquire bones which show up when individuals die. If you obtain enough bones you come to be the king of the damages. There are a lot of other modes, some with shorter times and less complicated goals, consisting of football. Yes, soccer.<br><br>Pokemon Showdown<br>Best Browser Games: Pokemon Showdown<br><br>If battling fitness instructors is the component of Pokemon games you take pleasure in, Pokemon Showdown is for you. You can jump straight right into suits versus other players without needing to level up or look after your pokemon beforehand. If you pass away, you don't need to go back to the pokemon facility as well as remainder up either-- you can jump straight into a new battle.<br><br>Pokemon Showdown allows you to fight making use of either a random group, or a custom team if you desire to specify which pokemon you 'd such as to function with. You can then quickly undergo a match, selecting actions and countering the various other instructor. This fast-paced game takes all of the job out of increasing pokemon, leaving simply unjustified pokemon takedowns.<br><br>Squadd.io<br>Best Browser Games: Squadd.io<br><br>An isometric shooter in which you can battle with your friends against an opposing team, or fight in a free-for-all with everybody. Power-up stations positioned in the arena give different weapons. There are a pair personalities to select from off the bat, and plenty even more to open as you rub out your opponents.<br><br>Ad<br>The main goal of the game is simply to stay to life and gain adequate factors to arrive of the scoreboard. The even more factors you earn the even more you level up as well as the even more weapons you can unlock. It's really quick to enter, excellent if you are trying to find busy matches.<br><br>Neptune's Pride<br>Best Browser Games: Neptune's Pride<br><br>Neptune's Pride, our webgame of the year back in 2010, is the epitome of defamation, two-faced, real human spitefulness. It's an actual time method game similarly that glaciers relocate actual time, established in space and all about stellar growth. Up to 8 players begin with a few galaxy, and afterwards broaden in an outward direction, till they satisfy somebody else, and either choose to not kill each other quickly, or have at it.<br><br>Since the fleets take hours, and often days, to receive from celebrity to star, that leaves you with a great bargain of time to play the diplomacy game, trying to seal partnerships and fall apart the structures of those of your opponents. You attempt to obtain them alone, when you recognize one event is out, and also simply start to delicately wear off at their trust fund, until they're a human shaped receptacle for uncertainty, and prior to you recognize it you've obtained stellar civil war on your hands, and also you can wipe up the pieces.<br><br>Or, I expect, you can play it like an honourable, suitable human. Yet where's the fun in that?<br><br>Catan Universe<br>Best web browser games: Catan Online<br><br>( Image credit rating: Kosmos).<br>Advertisement.<br>A classic boardgame brought right into your web browser. Catan helped introduce the gold age of boardgames as it grew increasingly more popular beyond Europe. If you've never played Catan, below's a free opportunity to dislike your good friends due to the fact that they will not offer you any kind of fucking grain.<br><br>Last Fantasy Tactics Battleground.<br>Best internet browser games - Final Fantasy Tactics Battleground.<br><br>( Image credit report: Square Enix).<br>Okay so it's not precisely a browser game in the way every little thing else on this checklist is, however it does run in your browser. You've currently read about TwitchPlaysPokemon yet FFT Battlegrounds is a completely various principle. Rather of defending control of the on-screen characters versus the remainder of conversation, an AI manages every one of the tactical battles. As a chatter, you put bank on which side you believe will certainly win and can invest your network Gil to call a personality after yourself with a picked course as well as ability. It might seem hands-off but it's equally as appealing as watching Marbles on Stream.<br><br>BEST SINGLEPLAYER BROWSER GAMES.<br>If you're trying to find something new to attempt that will not take up valuable disk drive area, check out these singleplayer web browser games. You can locate a few added solo web browser choices in our best free PC games listing also.<br><br>Fallen London.<br>Browser games - Fallen London.<br><br>( Image credit score: Failbetter Games).<br>Fallen London is the long-running story browser game that preceded Failbetter Games' later Sunless Seas as well as Sunless Skies in the same universe. Regardless of the launch of 2 paid games, Fallen London still obtains new material and also stories added and also lately had a wonderful update to the look of its map too. You play as a novice to underground London, a person of recreation able to handle strange side tasks while approving quests to dig up the tricks of the below ground city.<br><br>A Dark Room.<br>A Dark Room.<br><br>( Image credit rating: Doublespeak Games).<br>A Dark Room begins as a clicker game, yet do not allow that deter you. It rapidly comes to be an approach adventure where you venture out battling enemies in real time to grow your post-apocalyptic community. You'll need to manage your village's resources so you can better furnish your personality on explorations. Hell, it also has a bit of a story and also a finishing to function towards as your find out more concerning the chilly, apocalyptic world.<br><br>Celeste Classic.<br>Best Browser Games - Celeste Classic.<br><br>( Image debt: Matt Makes Games).<br>Prior to it was a popular platformer, Celeste was a free browser game by the exact same name. You can still play that very early variation, currently called ""traditional"" for a jaunt via the game jam that ended up being an acclaimed indie game. The complete release is one of the most effective indie games around.<br><br>Sort The Court.<br>Browser games - Sort The Court.<br><br>( Image credit: Graeme Borland).<br>Kind The Court is a little bit like a lite variation of Yes, Your Grace. As the ruler, your lots of topics (be they princesses, wizards, or felines) come to you asking for favors. Some desire money, some food, others might be wanting to strike a bargain. You'll choose that obtains an item of the imperial pie with a simple Yes or No response to each request. Best of luck keeping all those peasants delighted as well as fed without emptying your treasury!</p>
<p> </p>","2021-10-16","1"
"2","Chesses are best games to play online","chesses-are-best-games-to-play-online","/blog-img/mcecsdflip02.jpg","<p>- University professor Dr. Pippin Barr has made the variation of chess they play in heck, as well as I, like it. All standard approach is gone, and each time you think you have actually discovered an opening, something confounding happens and also it falls apart in a pair relocations.</p>
<p>- University professor Dr. Pippin Barr has actually made the variation of chess they play in heck, as well as I like it. All standard approach is gone and each time you think you have actually discovered an opening, something confounding happens, and also it falls apart in a pair relocations.<br><br>Gravity is component of Barr's newest browser game, Chesses, which includes several chess variants. In Gravity, the board is arranged like a normal chess board (rotated 90-degrees), however the items are up to the 'lower' when there are nothing else items sustaining them. If white plays a pawn first, for example, it will promptly drop to the bottom of the board, and also the row of pawns will stop by one, subjecting the leading rook.<br><br>There's no AI to play against, however I've been playing against myself and also the scenarios I'm able to place both sides in are strange. Take the situation imagined listed below. What is white to do? They can't move any one of their pawns in the second row, because that would certainly create black's diocesan to go down one space and also examine their king. Black has actually safeguarded the same board placement on their side with a knight.</p>
<p xss=removed>&lt;iframe style=""width: 681px; height: 382px;"" src=""https://www.youtube.com/embed/bpUfZb0iN9c"" width=""681"" height=""382"" allowfullscreen=""allowfullscreen""&gt;&lt;/iframe&gt;<br>( Image debt: Pippin Barr).<br>At the end of a game of Gravity, it frequently becomes difficult to stack pieces high sufficient to cross enemy lines. At some point you're entrusted to a row of enduring pawns that can't obtain previous each other, as well as a draw.<br><br>Attacking the king is not easy. State the space above the adversary king is protected by one of your bishops, as well as then you stick a rook on the king's head. It looks like checkmate, but it isn't, due to the fact that the king can 'leap' up, take the rook, and after that fall back to its initial position. It is quickly in the diocesan's line-of-fire, but the rules only think about where an item is mosting likely to wind up when a turn has completely solved.</p>","2021-10-16","1"
"3","AGAR.IO some of the best games","agario-some-of-the-best-games","/blog-img/io_games_vd.jpg","<p>Agar.io is usually the game many people think of when searching for browser-based games. In this MMO action game, gamers take control of a round cell as it hunts to consume smaller-sized static cells. Other gamers control rival cells, which you have to take on for food-- and also, if their enclosure is more significant than your own is, after that, you risk becoming their food if they capture you. This is where points get intriguing: the bigger your cell, the slower you relocate.</p>
<p><img src=""https://kizi10.org/uploads/images/blog/post-image-1634627550515.jpg"" alt=""Agar io"" width=""800"" height=""451""><br>So what do you do when you're also sluggish to eat cells but as small to take in every little thing in view? Cells can split in fifty percent at will, providing gamers two private cells to control. Each cell can break up to 4 times, enabling players to escape specific death when managing a prominent opponent. Agar.io's very addicting gameplay, along with its five unique multiplayer settings, make it one of the best io games.</p>","2021-10-19","1"
"4","FLAPPYROYALE.IO the second best game","flappyroyaleio-the-second-best-game","/blog-img/flappy_sad.jpg","<p>Flappy Bird may be a remote memory for some individuals, but also those in the recognize, this hardcore side-scroller resides on as an io game. The 2014 mobile smash hit demanding gamers to regulate a yellow bird as it stumbles its means via the air. Orta Therox and Em Lazer-Walker, the developers of Flappy Royale.io, have modernized the flappy formula to produce a new sort of experience.<br><br>You compete against 99 other flappers and also browse your method past as many green pipelines as possible before unavoidably bumping your birdy noggin on among them. The devs state on their internet site that many gamers stop working to endure past the first two pipes, so if you survive for greater than five seconds, you've got a fantastic opportunity of winning. Flappyroyale.io is the ideal instance of that 'just one more shot' sensation-- you'll be hooked after just one go.</p>
<ul xss=removed>
<li>00<img src=""https://kizi10.org/uploads/images/blog/mceclip06.jpg"" alt="""" width=""800"" height=""600""></li>
</ul>","2021-10-19","1"
"5","SLITHER.IO the third of best game","slitherio-the-third-of-best-game","/blog-img/mceclipsdf05.jpg","<p>Bear in mind the timeless mobile game Snake? Slither.io takes that very same principle and mixes it with Agar.io. The outcome is an even simpler variation of Agar.io that is simply habit-forming to play. Slither.io places gamers in the body of a serpent as it takes in neighboring pellets ... you see where we're opting for this?<br><br>The technique for Slither.io is slightly different, as you don't have the split cells technician to bail you out of any tricky circumstances. You have access to a temporary increase, yet this won't conserve you if your challenger has taken care of engulfing you right into their curled snake body. You may intend to play the game for five mins, but that can quickly develop into an hour, many thanks to Slither.io's gameplay loophole.</p>","2021-10-19","3"
"6","DIEP.IO is one of the best game pc","diepio-is-one-of-the-best-game-pc","/blog-img/best-io-games-tetrio-900x506.jpg","<p>Established by Matheus Valadares, the developer of Agar.io, <strong>Diep.io</strong> is a tank game that happens in a 2D arena. Each player manages a tank, which is initially only efficient in firing one missile at a time. As gamers damage polygon items and adversary containers, they can level up their vehicles to make them relocate quicker, strike harder, and become extra tanky. Damaging practical enemy containers compensate players with high quantities of experience points, approving you several levels up immediately.<br>Diep.io has eight multiplayer settings, consisting of numerous team-based locations, which are probably the most intriguing out of the number. There's currently a fair bit of strategy in this tank game, yet including a couple of companions opens up a new level of control. You do not require a highly comprehensive approach to dominate various other teams; you need to interact. Diep.io is at its best when two groups of equal ability levels can obtain together to fight it out for the crown.</p>","2021-10-19","1"
