"id","page_name","page_url","description","has_content","content_value"
"5","played games","/played-games","<p>Welcome to the ultimate gaming destination where you can dive into the world of most played Games, offering an unparalleled selection of titles that cater to every gamer's taste and preference. Whether you're in the mood for action-packed adventures, brain-teasing puzzles, or immersive simulations, our platform has something for everyone. Explore our curated collection of the most popular and beloved games, handpicked to ensure maximum enjoyment and entertainment.</p>
<p>Discover the thrill of the most played Games with our Popular most played Games section, where you'll find the hottest and most talked-about titles of the moment. Join millions of players worldwide in experiencing these top-rated games that have captured the hearts and minds of gamers everywhere.</p>
<p>For those seeking the cream of the crop, look no further than our Best most played Games selection. These top-rated titles have earned rave reviews for their innovative gameplay, stunning graphics, and addictive mechanics. Dive into an unforgettable gaming experience with these must-play games.</p>
<p>Stay ahead of the curve with our New most played Games section, where you'll find the latest releases and freshest additions to our gaming library. From exciting new adventures to innovative gameplay mechanics, these games are sure to keep you on the edge of your seat.</p>
<p>Explore our Atoz most played Games section for a comprehensive overview of all the best titles available. With a wide range of genres and styles to choose from, you're sure to find something that suits your gaming preferences.</p>
<p>Step into the world of coin collecting with our <a class=""gameKeyword"" href=""https://www.kizi10.org/home/keyword/coin/popular"" target=""_self"">Popular Coin Games</a>, where you can embark on exciting adventures to gather coins and treasures. Whether you're navigating through challenging levels or competing against friends, these games offer endless fun and excitement.</p>
<p>Get ready to put your slicing skills to the test with <a class=""gameKeyword"" href=""https://www.kizi10.org/game/play/soap-cutting-3d-game"" target=""_self"">Soap-Cutting-3d-Game</a>. Dive into a world of colorful soap bars and slice them into satisfying shapes and patterns. With realistic physics and vibrant visuals, this game offers a relaxing yet challenging experience for players of all ages.</p>
<p>Experience the thrill of Online Games Free most played Games Unblocked For PC, where you can enjoy your favorite games without any restrictions. Whether you're at home or on the go, these unblocked games offer endless entertainment right at your fingertips.</p>
<p>Join the online gaming community with Free most played Io Games, where you can compete against players from around the world in fast-paced multiplayer action. With a wide range of genres and styles to choose from, there's something for every taste and preference.</p>
<p>Looking for inspiration? Explore our collection of Html5 most played Game Ideas, where you'll find a wealth of creative and innovative game concepts waiting to be explored. From unique gameplay mechanics to immersive storytelling, these games offer a glimpse into the future of gaming.</p>
<p>Engage young minds with Html5 most played Games Classroom, where educational games provide a fun and interactive way to learn new concepts and skills. From math and science to language arts and history, these games cover a wide range of subjects in an engaging and entertaining format.</p>
<p>Enjoy the best gaming experience without breaking the bank with Best most played Games For Free. With a wide selection of free-to-play titles available, you can enjoy hours of gaming fun without spending a dime.</p>
<p>Looking for a way to pass the time between classes? Check out our collection of Fun most played Games To Play At School, where you can enjoy a quick gaming session without any hassle or distractions.</p>
<p>Immerse yourself in stunning visuals and immersive gameplay with Best Free most played Games Best For PC. With a wide selection of high-quality titles available, you can experience the best that gaming has to offer right from the comfort of your own home.</p>
<p>Discover a treasure trove of gaming delights with Website To Play most played Game Background, where you'll find a wide selection of games across genres and styles. Whether you're a casual gamer or a hardcore enthusiast, there's something for everyone to enjoy.</p>
<p>Unleash your inner gamer with Website To Play most played Games Unblocked, where you can enjoy your favorite games without any restrictions or limitations. With a wide selection of titles available, you'll never run out of new games to explore.</p>
<p>Experience the thrill of gaming without any downloads or installations with Play Free most played Game Java. Simply click and play your favorite games instantly, without any hassle or fuss.</p>
<p>Dive into the world of most played games and discover a universe of endless possibilities and excitement. With a wide selection of genres, styles, and gameplay experiences to choose from, there's something for everyone to enjoy. So what are you waiting for? Start your gaming adventure today!</p>","0",
"10","blogs","/blogs","blog","0",
"11","categories","/categories","Dive into the exciting world of aircraft games, where the sky is not the limit but just the beginning of your aerial adventures! Whether you’re a seasoned pilot or a budding aviator, these games provide a wide variety of experiences that cater to every preference. From realistic flight simulators that emulate the intricacies of navigating an aircraft to fast-paced action games that pit you against enemy planes, there's something here for everyone.<br /><br />Players can choose from an array of aircraft types, including commercial airliners, military fighter jets, and even futuristic spaceships. The thrill of soaring high above the clouds, maneuvering through tight spaces, or engaging in epic dogfights will leave you breathless. The graphics and sound effects in these games have improved significantly, allowing for an immersive experience that makes you feel like you’re truly in the cockpit. <br /><br />For those who enjoy strategy, some aircraft games incorporate elements of resource management and tactical plan crafting, challenging players to make split-second decisions that can lead to victory or defeat. Whether you’re executing aerial stunts in an airshow or coordinating military missions, each game offers unique challenges that will keep you on the edge of your seat.<br /><br />Moreover, multiplayer options in many aircraft games allow you to compete or cooperate with friends and players around the world, adding a social aspect that enhances the fun. It’s not just about flying; it’s about the camaraderie and competition that brings players together.<br /><br />To discover various aircraft games that can captivate your attention and keep you entertained for hours, check out this collection of exciting titles. Experience the thrill and artistry of aviation in a completely interactive way through <a class=""gameKeyword"" href=""../../../tag/aircraft"" target=""_self"">Aircraft Games</a>. Whether you're looking for realism, adventure, or pure fun, the sky’s the limit!","0",
"12","search","/search","<p>Are you not finding what you are search for? Do you want a tip on what activities to look for? Don't stress. I wrote a couple of words listed below to assist you in discovering some cool and intriguing video games to fill your spare time.</p>
<p>Looking for a one-stop destination for all your gaming cravings? Dive into a world of endless entertainment with our vast collection of Search Games. Whether you're on the hunt for the latest releases, the most popular picks, or the absolute best in the genre, we've got you covered. From classic favorites to innovative new titles, our selection caters to every taste and preference.</p>
<p>With Search Games, the fun never stops. Discover an array of exciting challenges that will put your skills to the test. From brain-teasing puzzles to adrenaline-pumping action, there's something for everyone to enjoy. Jump into the fray and see if you have what it takes to conquer each level and emerge victorious.</p>
<p>Looking for the hottest trends in gaming? Check out our Popular Search Games section, where you'll find the most talked-about titles of the moment. Join the community and see why these games are capturing the hearts of players around the world.</p>
<p>On the hunt for something fresh and exciting? Explore our collection of New Search Games and be the first to experience the latest innovations in gaming. With new releases added regularly, there's always something new and thrilling to discover.</p>
<p>For those seeking the ultimate gaming challenge, look no further than our selection of Best Search Games. These top-rated titles have earned rave reviews from players and critics alike, delivering an unparalleled gaming experience that will keep you coming back for more.</p>
<p>But the excitement doesn't stop there. Dive into the world of <a class=""gameKeyword"" href=""https://www.kizi10.org/home/keyword/cut/rated"" target=""_self"">Best Cut Games</a> and experience the thrill of precision cutting and slicing. Test your reflexes and strategy as you navigate through a series of challenging puzzles and obstacles. With stunning graphics and addictive gameplay, these games are sure to keep you on the edge of your seat.</p>
<p>Looking for a game that's both simple and addictive? Check out <a class=""gameKeyword"" href=""https://www.kizi10.org/game/play/circle-collector"" target=""_self"">Circle Collector</a>, where you must navigate your way through a maze of obstacles while collecting as many circles as possible. With intuitive controls and endless replay value, this game is perfect for players of all ages.</p>
<p>Whether you prefer to play online or offline, on your browser or on your mobile device, we've got you covered. Our Website To Play Search Games offers a seamless gaming experience across all platforms, so you can enjoy your favorite games anytime, anywhere.</p>
<p>With HTML5 Search Games Online, you can immerse yourself in stunning visuals and smooth gameplay right in your web browser. No downloads or installations required – simply click and play!</p>
<p>Looking for the most realistic gaming experience? Look no further than our collection of What Is The Most Realistic Search Games Go. With cutting-edge graphics and immersive gameplay, these games blur the line between fantasy and reality, transporting you to worlds beyond your imagination.</p>
<p>Got little ones eager to join in on the fun? Our Online Play Search Games For Kids section offers a safe and enjoyable gaming experience for children of all ages. With a variety of age-appropriate games to choose from, you can rest assured knowing that your kids are in good hands.</p>
<p>But why stop there? Explore our selection of IO Search Game Java and experience the thrill of multiplayer gaming at its finest. Join forces with players from around the world as you battle for supremacy in fast-paced, action-packed showdowns.</p>
<p>Looking for the best of the best? Our Online Search Games Best section features hand-picked titles that are sure to impress even the most discerning gamers. From award-winning classics to hidden gems, you'll find it all right here.</p>
<p>Ready for a challenge that will push your skills to the limit? Check out our Crazy Search Games For PC, where you'll encounter mind-bending puzzles and heart-pounding challenges that will test your reflexes and strategy like never before.</p>
<p>And don't forget to keep an eye out for our latest title, New Search games! With fresh releases added regularly, there's always something exciting to look forward to.</p>
<p>So what are you waiting for? Dive into the world of Search Games today and embark on an unforgettable gaming adventure!</p>
<p>The ideal games you can easily explore through groups or even tags are capturing, auto video games, challenges, and lady's activities. Are you actually pondering just how to find a great video game? You may hunt, for instance, pixel as. Well, we are going to present a few of our brand-name fantastic activities like multiplayer shooting games, for example, the <a href=""../../../game/play/survival-shooting-war-game-pixel-gun-apocalyp/"">Survival shooting war game pixel gun apocalypse three</a> and <a href=""../../../game/play/gungame-shooting-warfare-blocky-gangster/"">GunGame shooting warfare blocky gangster</a>, or if you desire some automobile activities, you can easily hunt for <a href=""../../../game/play/island-clean-truck-garbage-sim/"">Island Clean Truck Garbage Sim</a>.</p>
<p>Do not give up if you don't, as if these video games permit an attempt to explore this time around make-up as well. It will present great games like Yuki's Fun Roulette as well as a couple of additional lady activities like <a href=""../../../game/play/antarctica-princess/"">Antarctica Princess</a> and <a href=""../../../game/play/ice-princess-hidden-hearts/"">Ice Princess Hidden Hearts</a>. To dig a lot more on our website, you may select the web page icon as well, and you will find the very best crazy games selected through us. You attempt a few more switches from the menu. Also, I am actually positive you will definitely play a number of our games.</p>
<p>You can easily seek any activities or customers, yet if you don't discover, listed below is actually how to begin.</p>
<p>Enjoy right here and also explore everlasting games you think are actually great for you to hang out here!</p>","0",
"13","tags","/tags","<p>Video games, known as ""<a href=""https://www.kizi10.org/home/keyword/action""><strong>action games</strong></a>"", include high-intensity physical challenges and rapid-fire gameplay that test players' reflexes and ability to think on their feet. <br />Combat, platforming, and puzzle-solving are common features in games of this kind. Players in action games often have access to a wide array of weapons and power-ups to kill foes and advance through stages. Grand Theft Auto, Assassin's Creed, and Call of Duty are just a few well-known titles that fall under this category.</p>
<p><a href=""https://www.kizi10.org/home/keyword/girls""><strong>Girls games</strong></a> aim to pique the interest of young women. The characters and plots of these games often centre on women. Girls' games aren't limited to only the role-playing genre. Barbie, My Little Pony, and Disney Princess are popular girls' games.</p>
<p>Stickman games were video games in which the players control stick figures. Fast-paced action games, such as platforming or puzzle-solving, is the main draw of these games, which typically include simplistic visuals. It's not uncommon for stick figures to appear in games that have shooting or combat. Games like Stickman Hook, Stickman Warriors, and Stickman Shooter are all great examples of the genre.</p>
<p>Video games in the Minecraft Games category are adaptations of the wildly successful sandbox game Minecraft. Open-world exploration, resource collection, and crafting are common gameplay elements these types of games share. It's not uncommon for Minecraft games to combine aspects of survival and adventure. Minecraft Dungeons, Minecraft Earth, and Minecraft Story Mode are all examples of well-liked Minecraft games.</p>
<p>Video games in which players take the role of a driver are sometimes referred to as ""driving games."" Typical titles in this genre include races where players may choose from various automobiles, trucks, and motorbikes. Other game types, such as simulation and open world, may be included in driving games. Popular titles in this genre include Gran Turismo, Need for Speed, and Forza Horizon.</p>
<p>The subgenre of driving games known as ""Truck Games"" focuses on, you guessed it, going and commanding trucks. These games put players in the role of a transporter, navigating hazardous locations while delivering goods. Other game types, including <a href=""https://www.kizi10.org/home/keyword/racing""><strong>racing games</strong></a> and puzzles, may be included in truck games. Games like Euro Truck Simulator 2, American Tractor Simulator, and Truck Driver are great examples of this genre.</p>
<p>The subgenre of driving games known as ""car games"" centres on the operation of motor vehicles. Many games include races and pit players against one another or computer-controlled foes. Games revolving around automobiles may take various forms, including simulation and open world. Forza Motorsport, Gran Turismo, and Project Cars are just a few of the many games in this genre.</p>
<p>To put it simply, <a href=""https://www.kizi10.org/category/shooting""><strong>shooting games</strong></a> are those in which the player takes control of a character who fires guns at virtual foes. Combat is a common feature of these games, requiring rapid reflexes and pinpoint precision to prevail over adversaries. Other game types, such as first-person shooters and adventures, might fall under ""shooting games."" Call of Duty, Battlefield and Halo are just a few examples of successful first-person shooter video games.</p>
<p>Video games whereby characters engage in hand-to-hand combat are known as fighting games. These games often have strategic features and demand players master intricate move sets to win. Other game types, such as action and role-playing, may be included in fighting games. Mortal Kombat, Tekken, and Street Fighter are successful fighting games.</p>
<p>""Zombie games"" are video games in which zombies are the main antagonists. In these games, players must employ various weapons and gadgets to survive against waves of zombies. Even non-shooter or non-adventure games may have zombies. Resident Evil and Left are two well-known examples of this subgenre of video games.</p>
<p>IO Games: IO games are browser-based, multiplayer, internet video games. These games offer live, one-on-one competition between players, often with simplistic visuals and gameplay mechanics. Any game, from racing to strategy to first-person shooters, may be made into an IO game. Agar.io, Slither.io, and Diep.io are all well-known IO games.</p>
<p>Video games developed in HTML5 may be played directly in a web browser without any extra plugins or applications. Puzzle, adventure, and platformer games are all fair for this category. The widespread availability and simplicity of creating HTML5 games have contributed to their meteoric popularity. Games like Cut the Rope, Angry Birds, and 2048, are all great examples of HTML5 games.</p>
<p>In a nutshell, action games are both challenging and exciting, including elements such as fighting and puzzle-solving. Games for female children tend to concentrate on topics like make-up, hairstyles, and fashion. The protagonists of these games are often stick figures, and the gameplay focuses on fast-paced action and platforming. Video games based on the popular sandbox game Minecraft often contain questing, looting, and building. Fun in the driving genre attempt to recreate the sensation of being behind the wheel, whereas games in the truck and automobile genres squarely emphasise the manipulation and control of such vehicles.</p>
<p>In shooting games, players fire guns at their opponents, whereas in fighting games, players engage in hand-to-hand combat. Zombies are the main antagonists of zombie games, which focus on survival and the use of weaponry to ward off hordes of the undead. Video games developed using HTML5 technology and playable in a web browser without the need for extra software fall into the same category as ""online multiplayer games played in a browser"" (also known as ""IO games"").</p>
The realm of tags games offers a diverse and thrilling experience for gamers of all ages. From brain-stimulating puzzles to adrenaline-pumping adventures, there is a wide variety of Popular tags Games that captivate players worldwide. This comprehensive guide will delve into some of the Best tags Games, explore New tags Games, and highlight Atoz tags Games that have become favorites among gaming enthusiasts.
<p>One of the standout titles in the world of tags games is <a class=""gameKeyword"" href=""https://www.kizi10.org/game/play/space-mission-truck"" target=""_self"">Space Mission Truck</a>. This game combines the excitement of space exploration with the challenge of navigating a powerful truck through extraterrestrial terrains. Players must complete various missions, overcoming obstacles and managing resources to succeed. With its unique blend of strategy and action, Space Mission Truck provides an engaging and immersive experience for players who enjoy a mix of science fiction and tactical gameplay.</p>
<p>Another exceptional game that has gained popularity is the <a class=""gameKeyword"" href=""https://www.kizi10.org/home/keyword/mathematical/rated"" target=""_self"">Best Mathematical Games</a> collection. These games are designed to sharpen mathematical skills while providing entertainment. They offer a range of challenges, from basic arithmetic to complex problem-solving, making them suitable for players of all ages. Best Mathematical Games not only enhance cognitive abilities but also make learning fun and interactive.</p>
<p>For those who love a mix of genres, Play tags Crazygames offers an extensive selection of games that cater to various tastes. From action-packed shooters to relaxing puzzle games, Crazygames provides something for everyone. The platform is known for its high-quality graphics and engaging gameplay, making it a popular choice among gamers.</p>
<p>Online tags Games On Poki is another fantastic resource for finding entertaining and diverse games. Poki hosts a wide range of games that can be played directly in your browser, eliminating the need for downloads. This convenience, combined with the variety of games available, makes Poki a favorite destination for casual gamers.</p>
<p>For those who prefer not to spend money on games, Online Games Free tags Games On Poki offers numerous free games that deliver high-quality entertainment. These games cover various genres and are designed to provide enjoyable experiences without any cost, making them accessible to a broad audience.</p>
<p>Gamers who enjoy playing on their PC might wonder, is there a free tags games best for PC? The answer is a resounding yes. There are numerous free tags games available that offer excellent graphics, engaging gameplay, and compatibility with PC platforms. These games ensure that players can enjoy top-notch gaming experiences without spending a dime.</p>
<p>Java-based games have a special place in the hearts of many gamers. Play Free tags Game In Java showcases some of the best Java games available, offering classic gameplay with a modern twist. These games are known for their stability and performance, providing a seamless gaming experience.</p>
<p>Kids tags Game Best Java Games are specifically designed to be entertaining and educational for younger audiences. These games help children develop various skills while ensuring they have a great time. The combination of fun and learning makes these games a valuable resource for parents and educators.</p>
<p>For gamers who prefer offline play, Poki tags Games Offline offers a range of games that can be enjoyed without an internet connection. These games are perfect for travel or areas with limited connectivity, ensuring that you can always have your favorite games at your fingertips.</p>
<p>For young boys who love adventure and action, Crazy Games Unblocked tags Games Boy offers a selection of games that are sure to thrill. These games are designed to be easily accessible and provide hours of entertainment with engaging storylines and dynamic gameplay.</p>
<p>Free online gaming remains a popular choice for many, and Online Games Free tags Free Online Games highlights some of the best free options available. These games offer a variety of genres and styles, ensuring that every player can find something they enjoy.</p>
<p>For those seeking a reliable source to find free online games, the Website To Play tags Free Online Games provides a curated list of top-rated games. This site is a valuable resource for discovering new games and enjoying high-quality entertainment without any cost.</p>
<p>In conclusion, the world of tags games is rich with opportunities for adventure, learning, and fun. From the strategic challenges of Space Mission Truck to the educational benefits of Best Mathematical Games, there is something for every type of gamer. Popular tags games continue to captivate players worldwide with their diverse genres and engaging gameplay. New tags games push the boundaries of creativity and innovation, ensuring that there is always something fresh and exciting to explore. Dive into the vast array of Atoz tags games today and experience the endless possibilities and joy that the gaming world has to offer. Whether you are playing on your PC, mobile device, or offline, the thrill of discovery and adventure is always just a click away.</p>
<div class=""bottom-border""> </div>","0",
