"id","page_name","page_url","description","has_content","content_value"
"3","best games","/best-games","<p>The gaming world is vast and dynamic, constantly introducing New Best Games that captivate players of all ages. Whether you are a fan of high-speed racing, engaging puzzles, or educational adventures, there is something for everyone. Let's explore some of the Best Games currently available and delve into why they have become Popular Best Games among gamers.</p>
<p>One exciting genre that has captured the hearts of many is racing. Among the top titles in this category is the <strong><a class=""gameKeyword"" href=""https://www.kizi10.org/home/keyword/racer/rated"" target=""_self"">Best Racer Games</a></strong> collection. These games offer thrilling experiences with realistic graphics and challenging tracks that test your driving skills. Whether you prefer fast-paced street racing or off-road adventures, Best Racer Games provide a diverse range of options that keep the adrenaline pumping.</p>
<p>For a more relaxed and educational experience, the <strong><a class=""gameKeyword"" href=""https://www.kizi10.org/game/play/clean-up-kids"" target=""_self"">Clean Up Kids</a></strong> game is an excellent choice. This game is designed to teach children the importance of cleanliness and organization through fun and interactive gameplay. Players help characters clean and organize different environments, making it both an educational and entertaining activity for younger audiences.</p>
<p>Gamers looking for comprehensive guides and tricks can visit the Website To Play Best Game Cheat App, which offers a plethora of cheats and tips for various games. This resource is invaluable for players who want to master their favorite games and discover hidden secrets.</p>
<p>For those who like to stay updated with the latest in gaming, Io Best Game News is a fantastic resource. This site provides news, reviews, and updates on the newest and most popular games, helping players stay informed about the gaming world.</p>
<p>The world of online gaming offers many free options with New Best Games Online Free. These games provide high-quality entertainment without any cost, making them accessible to everyone. From action-packed adventures to mind-bending puzzles, there is something for every type of gamer.</p>
<p>Multiplayer games have also become incredibly popular, allowing players to connect and compete with others worldwide. New Best Game Multiplayer features some of the best multiplayer games available, offering exciting and collaborative experiences that bring people together.</p>
<p>In environments where gaming might be restricted, Crazy Games Unblocked Best Games Unblocked At School provides access to a variety of games that can be played even in restricted settings. These games ensure that students can enjoy their favorite titles without any hindrance.</p>
<p>For those who appreciate stunning visuals, understanding What Is The Coolest Best Game Background can enhance the gaming experience. Games with beautiful backgrounds and immersive environments can transport players to different worlds, adding to the overall enjoyment of the game.</p>
<p>Exploring different game designs and mechanics can be both fun and educational. Play Free Best Game Examples showcases some of the most innovative and well-designed games available, providing inspiration and entertainment for gamers and developers alike.</p>
<p>Laptop users can find a range of suitable games with Poki Best Games For Laptop. These games are optimized for portable devices, ensuring smooth performance and enjoyable gameplay on laptops.</p>
<p>Preschoolers can also join in on the fun with Online Play Best Games For Preschool. These games are designed to be both entertaining and educational, helping young children develop skills while having a great time.</p>
<p>For those wondering if there are free gaming apps available, Is There A Free Best Games Apps provides a list of the best free gaming apps. These apps offer high-quality gaming experiences without any cost, making them accessible to a wide audience.</p>
<p>---------------</p>
<p>In the world of online gaming, the quest for the <strong>Best Games</strong> is an ongoing adventure. Players are constantly on the lookout for the most thrilling experiences across various platforms. Whether you're into action-packed adventures, mind-bending puzzles, or adrenaline-pumping challenges, the allure of the <strong>Popular Best Games</strong> is irresistible. These games not only entertain but also captivate with their immersive gameplay and stunning graphics.</p>
<p>Among the myriad options available, <strong>Icedlevel Games</strong> stand out as a unique blend of strategy and fun. Known for their innovative gameplay mechanics and engaging storylines, <strong>Icedlevel Games</strong> offer players a chance to explore new worlds and conquer formidable challenges. From navigating icy terrains to solving intricate puzzles, each game in the <strong>Icedlevel Games</strong> collection promises an exhilarating experience.</p>
<p>One such gem is <strong>Pirate Travel Coloring</strong>, a delightful addition to the realm of online gaming. This game combines the joy of coloring with the thrill of pirate adventures. Set sail on a virtual voyage as you fill intricate designs with vibrant hues. Perfect for players of all ages, <strong>Pirate Travel Coloring</strong> transforms the traditional coloring book into an interactive journey across the high seas.</p>
<p>When it comes to <strong>Best Best Games</strong>, enthusiasts are often on the lookout for titles that redefine gaming excellence. Whether you're on a quest to <strong>Play Best Games Free To Play</strong> or seeking to uncover <strong>What Is The Coolest Best Games PC</strong>, the options are as diverse as they are exhilarating. From console classics to cutting-edge PC releases, the world of gaming continues to evolve, offering something for every player.</p>
<p>For those who prefer gaming on the go, <strong>New Best Games</strong> for mobile devices present an enticing array of choices. From fast-paced action games to thought-provoking puzzles, these titles showcase the best in mobile gaming technology. Wondering <strong>What Is The Best Free Best Game Mobile</strong>? The answer lies in the seamless blend of gameplay and portability, allowing you to dive into your favorite games anytime, anywhere.</p>
<p>In the realm of gaming communities, discussions often turn to strategies and tips, including <strong>What Is The Best Free Best Game Cheat App</strong>. While integrity in gaming remains paramount, these apps offer insights and shortcuts that can enhance the gaming experience for enthusiasts. Whether you're mastering a <strong>Free Best Game For Laptop</strong> or exploring the depths of a virtual universe, these tools can provide an edge.</p>
<p>The appeal of online gaming extends beyond mere entertainment. For many, it's about creating memorable experiences and forging connections with fellow gamers. Platforms like <strong>Poki Best Game Background</strong> offer a rich tapestry of games, each with its own story to tell. Whether you're delving into <strong>Html5 Best Games Online Free No Download</strong> or embarking on an <strong>Io Best Games Browser</strong> adventure, the possibilities are endless.</p>
<p>Amidst the vast landscape of gaming options, players often seek recommendations on <strong>What Is The Best Free Best Games For Free</strong>. Whether you're exploring a new genre or revisiting a classic, discovering the best games for free adds to the thrill of gaming. Platforms like <strong>Website To Play Best Crazygames</strong> curate a diverse collection of games, catering to every taste and preference.</p>
<p>At the heart of it all lies a shared passion for gaming. Whether you're a casual player or a seasoned enthusiast, the quest for the <strong>Best Games</strong> continues to unite gamers worldwide. With each new release and innovative gameplay mechanic, the landscape of online gaming evolves, promising new adventures and unforgettable experiences.</p>
<p>Rated Best Games is a category that highlights the top-rated games across various genres. These games have been praised by players and critics alike for their exceptional quality, engaging gameplay, and innovative features.</p>
<p>In conclusion, the world of gaming is rich with opportunities for adventure, challenge, and fun. Whether you are into high-speed racing, educational games for kids, or the latest multiplayer experiences, there is a game out there for you. With the rise of New Best Games, the options are endless, and the thrill of discovery is always just a click away. Dive into these exciting games today and experience the joy and excitement they bring. The continuous development of Atoz Best Games ensures that players always have fresh and engaging content to explore. So, get ready to embark on new adventures and enjoy the best that the gaming world has to offer.</p>","0",
"4","featured games","/featured-games","<p>Welcome to the world of Featured Games, where entertainment meets excitement. Whether you're looking for a quick gaming session or a deep, immersive experience, our collection has something for everyone. Our library of games is constantly updated, ensuring you have access to the latest and greatest in gaming. Dive into the fun and explore our categories including Popular Featured Games, New Featured Games, Atoz Featured Games, and more.</p>
<h3>Popular Featured Games</h3>
<p>Our Popular Featured Games section is where you'll find the most played and loved games by our community. These games have been handpicked based on their popularity and user ratings. From action-packed adventures to strategic puzzles, there's something for every type of gamer. Check out what's trending and join millions of players in enjoying these top-rated games.</p>
<h3>New Featured Games</h3>
<p>Stay ahead of the curve with our New Featured Games. This section is dedicated to the freshest and most innovative games available. We update this category regularly to include the latest releases, ensuring that you never miss out on new gaming experiences. Whether you're into fast-paced shooters or relaxing puzzle games, our new featured games will keep you entertained.</p>
<h3>Atoz Featured Games</h3>
<p>Discover a comprehensive list of games in our Atoz Featured Games category. This section includes a wide variety of games sorted alphabetically, making it easy for you to find exactly what you're looking for. From A to Z, we've got it all. Explore different genres and find new favorites in our extensive collection.</p>
<h3>Poki Featured Game Multiplayer</h3>
<p>One of the standout categories is Poki Featured Game Multiplayer, where you can challenge friends and players from around the world. Engage in competitive matches or cooperative gameplay in a variety of multiplayer games. These games are designed to bring people together, making them perfect for social gaming sessions.</p>
<h3>Fun Featured Game Featured Android Games</h3>
<p>For mobile gamers, our Fun Featured Game Featured Android Games category offers a fantastic selection of games that you can play on the go. These games are optimized for Android devices, providing smooth and enjoyable gameplay experiences. From casual games to more complex titles, our Android games are sure to keep you entertained wherever you are.</p>
<h3>Online Games Free Featured Games For Android</h3>
<p>Enjoy a plethora of Online Games Free Featured Games For Android. These games are free to play and easily accessible on your Android device. With no downloads required, you can start playing right away. Whether you prefer action, strategy, or puzzle games, our online free games offer endless fun at your fingertips.</p>
<h3>Featured Featured Games Featured For PC</h3>
<p>For those who prefer gaming on a bigger screen, check out our Featured Featured Games Featured For PC. This section includes games that are specifically designed or optimized for PC play. Enjoy high-quality graphics and immersive gameplay on your desktop or laptop. From indie gems to blockbuster titles, our PC games cater to all types of gamers.</p>
<h3>Who Is The Featured Featured Games Offline</h3>
<p>If you're looking for games that you can play without an internet connection, our Who Is The Featured Featured Games Offline section is perfect for you. These games are ideal for long trips or times when you don't have access to Wi-Fi. Enjoy uninterrupted gaming sessions with our selection of offline games.</p>
<h3>Play Free Featured Games Online</h3>
<p>Our Play Free Featured Games Online category offers a vast collection of games that you can play for free in your browser. No need to download or install anything. Simply choose a game and start playing. This section is perfect for those who want to try out different games without any commitment.</p>
<h3>Featured Free Featured Games On Poki</h3>
<p>Explore the Featured Free Featured Games On Poki. Poki is known for its diverse range of free-to-play games, and our featured section highlights the best of the best. These games are not only fun but also provide great replay value. Discover new adventures and challenges on Poki.</p>
<h3>Featured Featured Game Java</h3>
<p>For fans of classic gaming, our Featured Featured Game Java category includes games that are built using Java. These games are known for their retro feel and nostalgic charm. Whether you're revisiting old favorites or discovering them for the first time, our Java games are sure to bring back fond memories.</p>
<h3>Who Is The Featured Featured Games Online Free No Download</h3>
<p>Enjoy hassle-free gaming with our Who Is The Featured Featured Games Online Free No Download section. These games require no downloads, allowing you to jump straight into the action. Perfect for those who want a quick gaming fix without the wait.</p>
<h3>Poki Featured Game In PC</h3>
<p>Experience the best of both worlds with Poki Featured Game In PC. This category features games that are popular on Poki and optimized for PC play. Enjoy seamless gameplay and high-quality graphics as you explore a variety of genres and titles.</p>
<h3>Flag Games</h3>
<p>In the midst of all these exciting categories, we have a special mention for Flag Games. These games are designed to test your knowledge and recognition of different country flags. They are educational and fun, making them perfect for players of all ages. One such game is the Flag Games, which challenges you to identify flags from around the world. It's a great way to learn and have fun at the same time.</p>
<h3>Logo Memory Challenge: Cars Edition</h3>
<p>Another exciting game worth mentioning is the Logo Memory Challenge: Cars Edition. This game is perfect for car enthusiasts and those who enjoy memory challenges. The game features logos from various car brands, and your task is to match them correctly. It's a fun and engaging way to test and improve your memory skills.</p>
<p>In conclusion, our collection of Featured Games offers something for everyone. Whether you're into multiplayer games, mobile gaming, or classic PC titles, you'll find a game that suits your preferences. Dive into our categories and start exploring today. Happy gaming!</p>
<p> </p>
<p>In today's digital age, online gaming platforms serve as modern-day arcades, offering a plethora of choices to cater to all types of players. Among these platforms, Kizi10.org stands out as a treasure trove of interactive fun, and its featured games section is a testament to this.</p>
<h2>Curated Selection</h2>
<p>What makes the featured games on Kizi10.org so unique? To start with, each title undergoes a rigorous selection process. This isn't merely a random assortment of fun but a curated collection designed to provide a fulfilling and varied gaming experience. Whether you're a puzzle fan, an action enthusiast, or someone who enjoys simple yet addicting arcade games, the featured section on Kizi10.org has something for everyone.</p>
<h2>A Dynamic Range of Genres</h2>
<p>Scrolling through the featured games, you'll notice an exciting range of genres. From fast-paced shooting games to intricate strategy puzzles, Kizi10.org ensures a diverse portfolio that appeals to players of all ages and skill levels. New titles are frequently added, keeping the roster fresh and engaging.</p>
<h2>User-Friendly Interface</h2>
<p>One of the most significant advantages of playing featured games on <strong><a href=""https://www.kizi10.org/updated"">updated games</a></strong> Kizi10.org is the user-friendly interface. With intuitive controls and easy-to-navigate menus, players can dive right into the action without a steep learning curve. Each game also comes with a brief description and user ratings, helping you decide which one to play next.</p>
<h2>Accessibility and Convenience</h2>
<p>Another benefit of the featured games, like<strong><a href=""https://www.kizi10.org/only-up-forward""> Only Up</a></strong>, is their accessibility. Being browser-based, these games don't require any downloads or installations. This means you can enjoy high-quality gaming without freeing up disk space or worrying about system compatibility.</p>
<h2>Community and Social Features</h2>
<p>Kizi10.org also offers social features like leaderboards and player reviews for its featured games. This creates a sense of community among gamers, encouraging friendly competition and the exchange of gaming tips. Knowing you’re part of a community enhances the gaming experience, making it more fulfilling and engaging.</p>
<p>In the middle of your gaming journey, don't miss out on the <a class=""gameKeyword"" href=""https://www.kizi10.org/home/keyword/flag"" target=""_self"">Flag Games</a>. These games are perfect for those who love geography and want to test their knowledge of world flags. With various levels of difficulty, players can challenge themselves to recognize flags from different countries, improving their memory and learning more about the world in the process. It's a great way to combine fun with education, making it ideal for players of all ages.</p>
<p>Another fantastic game to explore is the <a class=""gameKeyword"" href=""https://www.kizi10.org/game/play/logo-memory-challenge-cars-edition"" target=""_self"">Logo Memory Challenge: Cars Edition</a>. This game is perfect for car enthusiasts and those who enjoy memory challenges. Players must match car logos in pairs, enhancing their memory and recognition skills while indulging in their passion for automobiles. With various levels to conquer, it’s a game that keeps you engaged and entertained, providing a satisfying and mentally stimulating experience.</p>
<p>These games are just a glimpse of what we offer. Dive in and discover more thrilling and educational games that cater to your interests and help you grow your knowledge and skills. Whether you're a casual gamer or a hardcore enthusiast, there's always something new and exciting waiting for you.</p>
<h2>Conclusion</h2>
<p>Kizi10.org sets itself apart by offering various games and carefully selecting those that make it to its featured list. This meticulous curation ensures a premium experience for all gamers, from casual players to dedicated enthusiasts. With its variety, accessibility, and community engagement, the featured games section is the jewel of <strong><a href=""https://www.kizi10.org/home/keyword/action"">action games</a></strong>. So why wait? Head over to Kizi10.org and dive into a world of unparalleled gaming fun!</p>
<p> </p>
<p>In the dynamic world of online gaming, the pursuit of the <strong>Bestscore Games</strong> continues to captivate players of all ages. Whether you're delving into the realm of <strong>Popular Bestscore Games</strong> or seeking out the latest <strong>Best Bestscore Games</strong>, the diversity of options ensures there's something for everyone's gaming palate. These games not only challenge reflexes but also stimulate strategic thinking and immerse players in captivating virtual worlds.</p>
<p>One standout in the realm of online gaming is <strong>Rocket Games</strong>, a series known for its fast-paced action and innovative gameplay mechanics. From navigating through asteroid fields to engaging in epic space battles, <strong>Rocket Games</strong> offer a thrilling blend of excitement and skill. Whether you're piloting a sleek spacecraft or commanding a fleet of rockets, each game in this collection delivers an adrenaline rush that keeps players coming back for more.</p>
<p>Another gem in the lineup is <strong>Impossible Box Rush</strong>, a game that tests agility and precision. Players maneuver through a labyrinth of obstacles, navigating tight corners and deadly traps in a race against time. With its challenging levels and responsive controls, <strong>Impossible Box Rush</strong> offers a true test of skill for those seeking a pulse-pounding gaming experience.</p>
<p>For enthusiasts looking to <strong>Play Bestscore Games Apps</strong>, the landscape is rich with options. Whether you're exploring <strong>What Is The Coolest Bestscore Games Classroom</strong> or searching for <strong>Is There A Free Bestscore Game Java</strong>, the variety ensures there's a game to suit every interest and platform. From educational games that blend learning with fun to casual challenges perfect for quick gaming sessions, the bestscore genre spans a wide spectrum of themes and gameplay styles.</p>
<p>Navigating the realm of <strong>Io Bestscore Game News</strong> reveals a vibrant community of players sharing strategies and discussing the latest updates. Whether you're diving into <strong>Play Bestscore Games For Adults</strong> or discovering <strong>What Is The Best Free Bestscore Games Silver Games</strong>, the online discourse enhances the gaming experience, fostering camaraderie and competition among players worldwide.</p>
<p>For younger gamers, <strong>Kids Bestscore Games For Free</strong> offer engaging adventures that stimulate creativity and problem-solving skills. These games combine colorful graphics with age-appropriate challenges, providing a safe and enjoyable gaming environment for children to explore and learn.</p>
<p>Platforms like <strong>Play Free Bestscore Games 3d</strong> and <strong>Play Bestscore Games Hub</strong> curate collections that cater to diverse tastes, ensuring accessibility and enjoyment for gamers of all preferences. Whether you're embarking on a solo quest or teaming up with friends for multiplayer showdowns, the allure of <strong>Bestscore games</strong> lies in their ability to entertain, challenge, and inspire players across the globe.</p>
<p>In conclusion, the world of <strong>Bestscore games</strong> continues to evolve, driven by innovation and a passion for interactive entertainment. From classic favorites to groundbreaking new releases, these games redefine what it means to play and compete in the digital age. Whether you're a seasoned gamer or just starting your journey, there's never been a better time to explore the thrilling world of <strong>Bestscore games</strong> and discover the next gaming adventure that awaits.</p>","0",
