"id","page_name","page_url","description","has_content","content_value"
"1","home","/","<p><strong>Kizi </strong><span data-preserver-spaces=""true"">is an internet browser game system with the best complimentary <strong><a class=""editor-rtfLink"" title=""Best CrazyGames"" href=""https://www.bestcrazygames.com"" rel=""noopener"">Best CrazyGames</a></strong></span><span data-preserver-spaces=""true"">. CrazyGames Online's website</span><span data-preserver-spaces=""true""> runs on the internet browser and can be played immediately without downloads or installs. You can play on Kizi10 on any device, including laptops, mobile phones, and tablet computers in any language.</span></p>
<p><span data-preserver-spaces=""true"">Other <a href=""https://www.brightestgames.com/cars"" target=""_blank"" rel=""noopener"">online car games</a> will help you improve your reflexes and driving abilities.</span></p>
<p><span data-preserver-spaces=""true""> This </span>game implies it's straightforward and quick to start playing at home, school, or work! Many KIDS play our gunman game<span data-preserver-spaces=""true""> in single-player Mod APK with a pal in two-player </span>online shooting games<span data-preserver-spaces=""true""> worldwide in a multiplayer environment. </span></p>
<p><span data-preserver-spaces=""true"">The most preferred games are Survival Shooting War, Pixel Gun Apocalypse 3, Hammer City, Destroy City Drive, and Moto Racer. However, everyone has their favourite shooting games online</span>, so start checking out and discovering your favourites. I recommend other websites for shooting online games.</p>
<p><strong>Kizi10</strong> Games is a browser platform with the finest free online shooting games. Our shooting games run free in the web browser and can be played instantaneously without downloads or installs. You can play Kizi10 games on any gadget, including laptops, smart devices, and tablet computers, whether at home, school, or the workplace! Over 15 million KIDS play our first-person shooting games monthly, alone in solitary gamer mode or with a close friend in a two-player game.</p>
<p><span data-preserver-spaces=""true"">Bullet Force, Krunker, Shell Shockers, Moto X3M, UNO, Minecraft Classic, Surviv.io and Doge Miner 2 are the most preferred game titles. However, everyone has their favourite <strong><a class="""" title=""backflip maniac"" href=""https://www.kizi10.org/game/play/backflip-maniac"" rel=""noopener"">backflip maniac</a></strong></span><span data-preserver-spaces=""true"">, so begin discovering your faves.</span></p>
<p>Kizi10 games is a web video game where you can play first-person shooting for free. A few years back, having everything cost-free would undoubtedly be an almost tricky initiative. Still, it is manageable today, and we are delighted to provide you with the very best crazy shooters that we have picked for you. Daily, we thoroughly choose brand-new multiplayer games free online to play every time you check our website, and you can try free online shooting games and many other exciting games.</p>
<p>Our goal is simple: to bring you the best multiplayer games. If you have ever desired to play free online games and have had whatever is nicely arranged where you can discover and play your preferred game in the blink of an eye, Kizi10 games are the ideal place! Our two-player games are into one of the most chosen categories, such as action games, driving games, multiplayer games, 3D games, and strategy games. Also, we would undoubtedly be fools if we failed to remember ready ladies because ladies also want to play two-player games! The most effective wager for those who would love to play more challenging and brainteasing games with friends will be our reasoning online games to play with friends, including several math-free girl games online. MMO followers will not be disappointed when they check out our listing of MMO games. We have everything for everybody, and you will not regret spending time with us.</p>
<p>All girl games you discover on our internet site are usable in your browser. Click on the play switch, as well as appreciate the game! Our utmost objective is to satisfy you while playing the best girl games you can locate on the web. Be with us and also be a component of the Kizi10 games household!</p>
<p>What are Kizi10 games?</p>
<p>Girl games accessible is a game author and also a game programmer. The Kizi10 games system is a social media of 30 million players and is expanding. Likewise, the website has videos to watch, like cartoons, gameplay video clips, and game walkthroughs. The media directory is growing daily as brand-new girl games per hour. As Kizi10 games have a long history, we have documented browser pixel gun 3D. This content is a crucial creative tool that clarifies what individuals were like during the various times.</p>
<p>Previously, Kizi10 games were well known for categories like arcade and classic 3D games when Bubble Shooter was the most-played internet browser game. Now, other styles have grown in appeal. Notably, two-player games have preferred web browser pixel guns and gown-up 3D games unblocked. One of the best sections is these multiplayer games. Play the extensive magazine on the web allowed 3D games car.</p>
<p>Kizi10 games are home for players on any gadget. Play car games in 3D or obtain rich 3D graphics on desktops by playing WebGL Games. Otherwise, if your choice is laid-back 2D worlds, HTML5 games will fit you. If you require a nostalgia boost, visit the legacy Flash games archive for all those car games for free that are not feasible elsewhere. The last point is don't neglect to register Your Kizi10 games<span data-preserver-spaces=""true""> Account. It's the social media network that supports the player's neighbourhood.</span></p>
<p>Kizi10 Games have become a beloved destination for gamers of all ages, offering a wide range of exciting and engaging titles. Whether you are looking for action-packed adventures, brain-teasing puzzles, or fun-filled activities, there is something for everyone on this platform. Let's delve into some of the most Popular Kizi10 Games and explore what makes them stand out in the gaming community.</p>
<p>One game that has captured the hearts of many is <strong><a class=""gameKeyword"" href=""https://www.kizi10.org/game/play/hot-jewels-adventure"" target=""_self"">Hot Jewels Adventure</a></strong>. This vibrant and thrilling game takes players on a journey through dazzling jewel-filled landscapes. The objective is to match and collect jewels to progress through increasingly challenging levels. With its stunning graphics and addictive gameplay, Hot Jewels Adventure is a must-play for anyone who loves puzzle games.</p>
<p>Another fantastic addition to the Kizi10 Games library is the <strong><a class=""gameKeyword"" href=""https://www.kizi10.org/home/keyword/minion/atoz"" target=""_self"">Atoz Minion Games</a></strong> collection. These games feature everyone's favorite little yellow characters in a variety of fun and entertaining scenarios. From action-packed adventures to creative problem-solving challenges, Atoz Minion Games offer something for every Minion fan. The engaging gameplay and charming graphics make these games a hit among players of all ages.</p>
<p class="""" data-start=""0"" data-end=""380"">Plants vs. Zombies Unblocked is a thrilling online tower defense game that brings the classic <em data-start=""158"" data-end=""178"">Plants vs. Zombies</em> experience to players without restrictions. This version allows fans to enjoy the strategic gameplay directly in their browser, making it accessible at school, work, or anywhere with internet access.</p>
<p class="""" data-start=""382"" data-end=""762"">In this game, players must defend their home from waves of hilarious yet menacing zombies by strategically placing various plants, each with unique abilities. Sunflowers generate energy, Peashooters attack enemies, and Wall-nuts provide barriers against advancing zombies. As the levels progress, the challenges become more intense, requiring smart planning and quick reactions.</p>
<p class="""" data-start=""764"" data-end=""1325"">The unblocked version retains the original game’s charm while offering seamless gameplay without downloads or installations. This makes it an excellent choice for casual players looking for a fun way to pass the time. Whether you're a longtime <em data-start=""1008"" data-end=""1028"">Plants vs. Zombies</em> fan or new to the series, <a class="""" href=""https://www.kizi10.org/game/play/plants-vs-zombies-unblocked"" target=""_new"" rel=""noopener"" data-start=""1055"" data-end=""1147"">Plants vs. Zombies Unblocked</a> provides endless entertainment with its addictive strategy-based mechanics. Dive into the battle, plant your defenses, and stop the zombie invasion before they reach your house!</p>
<p>For those who enjoy playing with others, What Is The Coolest Kizi10 Game Multiplayer offers a selection of multiplayer games that allow players to connect and compete with friends and strangers around the world. These games are designed to foster interaction and teamwork, providing a dynamic and engaging gaming experience.</p>
<p>Fans of Io games will find a treasure trove of options with Who Is The Best Kizi10 Io Games. These games are known for their simple yet addictive gameplay, allowing players to compete for dominance in various scenarios. The competitive nature and easy-to-understand mechanics make Io games a popular choice among Kizi10 users.</p>
<p>For online gaming enthusiasts, What Is The Best Online Kizi10 Games Online offers a curated list of the top-rated online games available on the platform. These games provide high-quality entertainment and can be played directly from your browser, making them accessible and convenient.</p>
<p>Parents looking for safe and fun games for their children can turn to the Website To Play Kizi10 Games Unblocked For Kids. This site offers a range of unblocked games that are suitable for kids, ensuring they have access to entertaining and age-appropriate content.</p>
<p>Kids Kizi10 Games Free is another excellent resource for finding free games that children can enjoy. These games are designed to be both fun and educational, helping kids develop various skills while having a great time.</p>
<p>For those who prefer not to download games, What Is The Best Free Kizi10 Games Online Free No Download offers a list of games that can be played without any downloads. These games provide high-quality entertainment without taking up space on your device.</p>
<p>Laptop users will appreciate the variety of options available with Io Kizi10 Games On Laptop. These games are optimized for laptop play, ensuring smooth performance and enjoyable gameplay on portable devices.</p>
<p>Students looking for a fun way to pass the time can Play Kizi10 Games At School. These games are designed to be easily accessible and provide a great way to take a break and have some fun during school hours.</p>
<p>For those interested in modified games, What Is The Best Online Kizi10 Game Mod offers insights into the best game mods available on the platform. These mods can enhance the gaming experience by adding new features and capabilities to existing games.</p>
<p>In conclusion, Kizi10 Games offer a rich and diverse gaming experience for players of all ages. From action-packed adventures to engaging puzzles and creative challenges, there is something for everyone on this platform. The Popular Kizi10 Games have garnered a loyal following due to their high-quality graphics, addictive gameplay, and innovative features.</p>
<p>New Kizi10 Games are constantly being added to the platform, ensuring that players always have fresh content to explore. Atoz Kizi10 Games provide a comprehensive range of titles that cater to different interests and preferences, making it easy for players to find something they enjoy.</p>
<p>Whether you are a fan of multiplayer games, Io games, or educational games for kids, Kizi10 has something to offer. The platform's commitment to providing high-quality and entertaining games makes it a favorite among gamers worldwide. Dive into the exciting world of Kizi10 Games today and discover the endless possibilities and fun that await you.</p>","0",
"2","new games","/new-games","<p>On our gaming platform, we strive to curate a top-notch selection of new online games that offer the ultimate interactive experience. Our freshly added games are designed to be enjoyable and educational for players of all ages. Just head over to our new games section, where many exciting choices await your exploration.</p>
<p>Whether you're into action-packed mobile and tablet games built on <strong><a href=""https://www.kizi10.org/home/keyword/html5"">HTML5</a></strong> or more intricate <strong><a href=""https://www.kizi10.org/home/keyword/webgl"">WebGL</a></strong> titles where you can embark on adventures or take down zombies, we've got something for you. For those who love the thrill of multiplayer battles, check out the latest .io games in our collection. These are perfect for engaging with others and making new friends online while indulging in some exhilarating gameplay on kizi10.</p>
<p>Prepare to flex your mental muscles with our range of math puzzles and quiz games that entertain and offer real-world applications. And if you're a fan of sports, fishing, or <a href=""https://www.kizi10.org/game/play/lion-hunter-king""><strong>hunting</strong></a>, our 3D Unity and WebGL simulation games promise endless hours of entertainment.</p>
<p>The gaming landscape is constantly evolving, bringing a plethora of New Games that capture the imaginations of players worldwide. Whether you're a fan of high-octane racing, strategic puzzles, or immersive adventures, there's always something new to explore. This comprehensive guide will delve into some of the most Popular New Games, highlighting the Best New Games that are making waves in the gaming community.</p>
<p>One standout game that has recently gained popularity is the <a class=""gameKeyword"" href=""https://www.kizi10.org/drawer-and-race"" target=""_self"">Drawer And Race</a> game. This unique and engaging game combines creativity with competition. Players must draw pathways for their characters to race along, requiring both artistic skill and strategic thinking. The innovative gameplay and vibrant graphics make Drawer And Race a must-try for anyone looking for something different in their gaming repertoire.</p>
<p>Another exciting addition to the gaming world is the <a class=""gameKeyword"" href=""https://www.kizi10.org/home/keyword/mine/news"" target=""_self"">New Mine Games</a> collection. These games offer players the chance to explore underground worlds, mine for valuable resources, and build their empires. With a variety of challenges and environments to navigate, New Mine Games provide endless hours of entertainment and discovery.</p>
<p>For those who enjoy gaming on the go, Html5 New Games Apps offer a wide range of options that can be played directly from your browser. These games are designed to be lightweight and responsive, ensuring a seamless experience across various devices.</p>
<p>Educational environments can also benefit from gaming with Poki New Games Classroom. These games are tailored to be both fun and educational, helping students engage with learning material in an interactive way.</p>
<p>Keeping up with the latest trends in gaming is made easy with Best Free New Game News. This resource provides updates, reviews, and insights into the newest and most exciting games available, ensuring that you are always in the know about the latest releases.</p>
<p>For those who prefer mobile gaming, finding the right apps can be crucial. What Is The Best Online New Games Apps offers a comprehensive list of top-rated gaming apps that provide high-quality entertainment on your mobile device.</p>
<p>Crazy Games is a well-known platform for a wide variety of games. Online Play New Games On Crazy Games introduces you to some of the best new titles available on this platform, offering diverse genres and gameplay styles to suit all preferences.</p>
<p>Accessibility is key in the gaming world, and New New Games Online Free provides a range of free games that can be played without any cost. These games ensure that everyone can enjoy high-quality gaming experiences regardless of their budget.</p>
<p>For those who like to see examples of innovative game design, Online Games Free New Game Examples showcases some of the most creative and well-crafted games available online. These games often push the boundaries of what is possible in gaming, offering fresh and engaging experiences.</p>
<p>Cheating might not be everyone's cup of tea, but for those who enjoy having an edge, What Is The Coolest New Game Cheat App offers insights into the best cheat apps available. These apps can enhance your gaming experience by providing shortcuts and advantages that make gameplay more exciting.</p>
<p>Multiplayer games have a unique charm, allowing players to connect and compete with others around the world. Html5 New Game Multiplayer features some of the best multiplayer games available in the HTML5 format, ensuring smooth and responsive gameplay.</p>
<p>Offline gaming is still popular among those who prefer not to rely on an internet connection. Free Online New Game In Offline provides a selection of games that can be enjoyed without being online, perfect for travel or areas with limited connectivity.</p>
<p>New Games are constantly being developed, offering fresh and exciting experiences for players of all ages. From action-packed adventures to mind-bending puzzles, the world of gaming is always evolving. Popular New Games capture the imaginations of players worldwide, and the Best New Games set new standards in gameplay and design.</p>
<p>New New Games continue to push the boundaries of creativity and innovation, ensuring that there is always something new and exciting to discover. The comprehensive range of Atoz New Games guarantees that players will find something to suit their tastes, whether they are looking for a quick casual game or a deeply immersive experience.</p>
<p>In conclusion, the gaming world is rich with opportunities for adventure, challenge, and fun. With the rise of New Games, players are constantly treated to fresh and engaging content. Dive into these exciting new titles today and experience the joy and excitement that the gaming world has to offer. Whether you're exploring underground mines or racing along drawn pathways, the thrill of discovery is always just a click away.</p>","0",
